rid,origin,application,name,rating,date,review,sentiment-score,sentiment,key phrases,entities
2023,Google Play Store,Capitec Bank,Jammy Gouws,2,30/01/2021 00:00:00,The app was amazing but now i cant even use the app. It is telling me that the app cant run on a rooted sellphone and that i need to do a factory reset on my phone. If you can fix it i will defently give the app a 5 star,0.00929749011993408,Negative,"star,factory,rooted sellphone,app,",NULL
2024,Google Play Store,Capitec Bank,Bradley Smith,1,30/01/2021 00:00:00,"Can't login to Banking App as it says my phone is rooted which it isn't, please help. It worked less than a week ago so am not sure if there was an update recently.",0.204218059778214,Negative,"update,week,phone,login,App,",NULL
2025,Google Play Store,Capitec Bank,Bradley Lovegrove,1,30/01/2021 00:00:00,This app worked fine until it updated now it doesn't work at all! It would be easier just to change to a new bank,0.832338750362396,Postive,"app,new bank,",NULL
2026,Google Play Store,Capitec Bank,Tremaine Pillay,1,29/01/2021 00:00:00,Worst app ever like really I tried to load my account and it's says activing but doesn't log in after 5mins Please fix this soon as possible coz no1 has time to stand in the lines,0.0180577337741852,Negative,"mins,lines,activing,account,Worst app,possible coz no1,time,",NULL
2027,Google Play Store,Capitec Bank,sunday abe,1,29/01/2021 00:00:00,I have been having serious issues with your app always saying I must do factory reset which I have done many times even went to your branches still nothing why eis,0.0545187294483185,Negative,"factory,eis,times,serious issues,branches,app,",NULL
2028,Google Play Store,Capitec Bank,Mayibongwe Dumani,5,29/01/2021 00:00:00,It's good and helpful and it's easy to use it to transfer money to my app And to my friends and family therapist intern at the same time,0.937101125717163,Postive,"money,time,app,friends,family therapist intern,",NULL
2029,Google Play Store,Capitec Bank,Karen Claassen,1,29/01/2021 00:00:00,There is a saying in the industry that one bug fix will likely introduce 200 new ones. Your latest update absolutely proved the point. Absolutely worst User Experience ever.,0.0813369750976562,Negative,"saying,worst User Experience,point,latest update,new ones,industry,bug fix,",NULL
2030,Google Play Store,Capitec Bank,Umra abdul aziz,1,29/01/2021 00:00:00,"Terrible , i hav ebeen uaing the app and all of a sudden it gives me an error saying thw capitec banking app cannot be rooted to cellphone, restore your device to ita factory settinga",0.000563681125640869,Negative,"ita factory settinga,cellphone,hav ebeen uaing,device,error,thw capitec banking app,",NULL
2031,Google Play Store,Capitec Bank,Juan Willers,3,22/01/2021 00:00:00,"Good App. Only issue I have is I have opted for the app notifications when I use my card,. But they don't show on the notification banner I have to go into the app under messages to see the notification. I have a Huawei P40 lite vers 10.136",0.00179505348205566,Negative,"messages,card,Huawei P40 lite vers,app notifications,",NULL
2032,Google Play Store,Capitec Bank,tanya van antwerp,1,22/01/2021 00:00:00,I've been having a problem with the app since day before yesterday. Called in to report yesterday. Deleted and reinstalled as instructed. Still saying currently unavliable. I need to make payments!! Whats going on? I've never before had any issues with this app,0.00000584125518798828,Negative,"Whats,payments,issues,problem,yesterday,app,",NULL
2033,Google Play Store,Capitec Bank,Charles Pretorius,1,22/01/2021 00:00:00,Your app has been in maintanace for 4 days now. Can't access it and do any transactions. Clearing app caches and doing a hard reboot does nothing.,0.0139382481575012,Negative,"transactions,days,maintanace,hard reboot,app caches,",NULL
2034,Google Play Store,Capitec Bank,Nthabiseng Sekhobela,1,18/01/2021 00:00:00,Frustrating setting up the app after having it on a previous phone. Sends ridiculous messages that one doesn't know what to do with it and when you call contact center the people are unable to assist and you must now go to the branch. What's the point of having this app on Play Store if I still need to go to the branch.,0.0895248055458069,Negative,"ridiculous messages,previous phone,point,Frustrating setting,Play Store,people,contact center,branch,app,",NULL
2035,Google Play Store,Capitec Bank,Yolanda Wilders,1,17/01/2021 00:00:00,My is not working for 3 days now. Keeps saying errors please fix is asp. Thanks.,0.209603726863861,Negative,"Thanks,days,asp,errors,",NULL
2036,Google Play Store,Capitec Bank,Radia Hendricks,1,16/01/2021 00:00:00,"My money showed In the app and I went to draw it, it declined 4 times, kept my card and I cudnt even do a cash send.Thanks! I was stranded, I'm very disappointed right now... Really I had to get to my son and I cudnt . Wen I can arrange for petrol I will come in. And please explain how this happpens wheny phone is in my hand and I'm at the ATM Seriously I bank with Capitec, I'm a loyal customer, why aren't there overdraft funds, why should I go Into the bank, if I applied for preapproved credit",0.000013500452041626,Negative,"son,times,Thanks,petrol,Wen,disappointed right,money,preapproved credit,cash,card,ATM,wheny phone,overdraft funds,Capitec,hand,loyal customer,bank,cudnt,",NULL
2037,Google Play Store,Capitec Bank,carmen lh,1,12/01/2021 00:00:00,"This version of the app is terrible. I have a new phone so I wanted to access my current account on the app. Had to redo the face scan several times because everytime I say ""scan"" it takes me back to entering my acc number. And when it finally worked, and I entered my correct contact details, it said that it wasn't correct and that I should go in to fix it. Even though I know for a fact that it was correct. So inconvenient and irritating.",0.000181823968887329,Negative,"fact,irritating,current account,new phone,acc number,face,app,version,everytime,times,correct contact details,scan,",NULL
2038,Google Play Store,Capitec Bank,Eden Karsten,1,12/01/2021 00:00:00,"I downloade thw app on a new phone, ive been struggling to access the app for a week now and i cant tell you how frustrating it is. All i see when i go in is a blank page so i went into a branch to be told that they not sure what the issue is they will uodate my interent banking.",0.0015207827091217,Negative,"week,branch,interent banking,issue,blank page,ive,new phone,downloade thw app,",NULL
2039,Google Play Store,Capitec Bank,connie goodall,2,12/01/2021 00:00:00,Two things missing on this app not to be able to use it on multiple phones with one account like FNB does and not being able to take screenshots which I need alot of time now I must ask someone els for phone to get a shot from the screen do this then it will be a 5 star,0.0289855003356934,Negative,"star,things,app,alot of time,screenshots,account,els,FNB,multiple phones,",NULL
2040,Google Play Store,Capitec Bank,Rene Johnson,1,12/01/2021 00:00:00,"Frustrating beyond measure I have been trying to access my banking app since yesterday to no a avail. I need this to work , a real inconvenience if I have to go into one if the branches",0.0000105798244476318,Negative,"branches,avail,real inconvenience,banking app,",NULL
2041,Google Play Store,Capitec Bank,Kevin Mashigo,1,12/01/2021 00:00:00,How many times must I take a picture? Keeps giving me the same message. I can't anymore. Not easy to use at all.,0.0947645902633667,Negative,"message,picture,times,",NULL
2042,Google Play Store,Capitec Bank,Gloria Williams,1,11/01/2021 00:00:00,I have been unable to transfer money from the app since yesterday morning up until today. Why does it take so long to fix this problem?,0.000687301158905029,Negative,"problem,morning,money,app,",NULL
2043,Google Play Store,Capitec Bank,Kabelo Mogane,1,10/01/2021 00:00:00,I personally feel this app is useless if you can't activate it yourself I didn't even wanna rate we downloading faulty app and still have to give you'll a star fix Ur apps,0.00130230188369751,Negative,"wanna rate,star fix Ur apps,faulty app,",NULL
2044,Google Play Store,Capitec Bank,Mpendulo Cherity,1,10/01/2021 00:00:00,I've just downloaded this app on my phone but I cant use it everytime I put in my savings account number n my pin its says it is unsuccessful because I've put in the wrong remote pin or savings account number...please help,0.000146657228469849,Negative,"app,phone,everytime,wrong remote pin,savings account number n,",NULL
2045,Google Play Store,Capitec Bank,Ntombekhaya Jacobs,1,10/01/2021 00:00:00,The app doesn't want to open. I am getting a notification to restart app and I've unistalled and reinstalled the app still nothing.,0.000365853309631348,Negative,"notification,app,",NULL
2046,Google Play Store,Capitec Bank,Jabulile Nkuna,1,10/01/2021 00:00:00,"Angati kumbe senifuna kudla timali tethu o njan?? been trying to log in since last week and the app keeps on saying ""access suspended""???? you are really making our lives difficult, we have bills to pay, this is so Frustrating",0.000000119209289550781,Negative,"access,week,bills,lives difficult,app,Angati kumbe senifuna kudla timali tethu o njan,",NULL
2047,Google Play Store,Capitec Bank,Camagu Mata,1,10/01/2021 00:00:00,"The card does not support a bunch of useful payment options ??, take samsung pay as an example, you guys need to catch up asap",0.013497918844223,Negative,"card,guys,example,bunch of useful payment options,samsung,",NULL
2048,Google Play Store,Capitec Bank,alpha shwala,1,06/01/2021 00:00:00,"I'm having an issue opening my app since yesterday, it doesn't even take me to the log in page when I open the app it kicks me out to my phone home page this is the worst app ever I went to the ATM and tried transferring there and it doesn't show my other 3 savings account if I could rate this app ZERO I would",0.0000000596046447753906,Negative,"ATM,issue,log,savings account,phone home page,app ZERO,worst app,",NULL
2049,Google Play Store,Capitec Bank,Leecia Mkhize,2,06/01/2021 00:00:00,Everything was fine until I changed phones when I installed to this new phone the app came different there's a lot missing from the app I can't even see the total of my money ??,0.00000521540641784668,Negative,"money,total,phones,lot,new phone,app,",NULL
2050,Google Play Store,Capitec Bank,Nikiwe Sishuba,5,05/01/2021 00:00:00,Superb the customer service is good.What I don't like is yu don't hav Sercurities in your ATMs like other banks .If the bank is closed you dont feel free to use the A TM.Another thing is if the computers are down the whole banks are down.WHY?WHY?,0.000108152627944946,Negative,"computers,dont,thing,yu,customer service,hav Sercurities,ATMs,banks,",NULL
2051,Google Play Store,Capitec Bank,Shelly Mujaji,1,05/01/2021 00:00:00,"I have a problem with this app now ,I bought electricity of R100 on this app it debits R60 then gives me units for R40 .can someone explain if you had a problem like this.I'm so disappointed",0.00127130746841431,Negative,"R40,units,electricity of R100,R60,problem,app,",NULL
2052,Google Play Store,Capitec Bank,Jarred Logie,1,02/11/2020 00:00:00,"It's hot garbage, the old app was better in every way. It took less time to load you could easily add beneficiaries and it didn't crash and lose connection every 2 minutes. Super unhappy that I was forced to move from the stable older app to this piece of garbage. To the response, even if the new app can do the same as the old app that doesn't excuse the fact that the new one constantly crashes and with errors.",0.000191032886505127,Negative,"beneficiaries,time,errors,minutes,connection,way,response,fact,hot garbage,piece of garbage,stable older app,new app,old app,",NULL
2053,Google Play Store,Capitec Bank,phone Account,3,02/11/2020 00:00:00,My phone is not rooted. It says it is. I know what rooted devices are. My PHONE is NOT ROOTED. My PHONE does NOT have a CUSTOM ROM. My PHONE does NOT have an UNLOCKED BOOTLOADER. I literally have to wait a month to have my bootloader unlocked if I wanted to root my device. I would remember doing that. I have the latest Android 11 with all security patches. Edit: All of a sudden its not yelling at me anymore and I did not do anything.,0.000000149011611938477,Negative,"devices,month,security patches,latest Android,UNLOCKED BOOTLOADER,phone,",NULL
2054,Google Play Store,Capitec Bank,Phindile Nzimande,1,01/11/2020 00:00:00,"I downloaded it few minutes ago, after putting the pin had to wait for 5 mins so that the app can be activated but still after 5 mins it doesn't get activated instead says retry ????",0.00000351667404174805,Negative,"app,minutes,pin,mins,",NULL
2055,Google Play Store,Capitec Bank,Julian White,1,01/11/2020 00:00:00,"My phone is not routed your app is rooted its head.why can I access all the 5 other banks I have on my brand new Samsung galaxy s21 ultra I have for 6 months and one morning I can't use capitec but still Nedbank, Absa Discovery Bank apps all work 100 %. I'm technically inclined I did look at my phone and it's definitely not rooted. Pathetic customer service you don't listen you have a bug on your app And wow just tried now again and it miraculously works out of the blue after blocking me 3days",0.0000219345092773438,Negative,"days,blue,bug,wow,banks,months,morning,Pathetic customer service,capitec,Absa Discovery Bank apps,brand new Samsung galaxy s21,Nedbank,phone,",NULL
2056,Google Play Store,Capitec Bank,Johann Praeg,1,01/11/2020 00:00:00,New app is terrible. Suddenly it says my phone is rooted which is not the case. Have tried everything and can't get access.,0.000379860401153564,Negative,"access,case,phone,New app,",NULL
2057,Google Play Store,Capitec Bank,Sibongakonke Dlamini,4,01/11/2020 00:00:00,Its a very good app in all expects but thay need to add a Hide option for the Live Better Savings seeing the amount i am saving can get very tempting. So please add a Hide option on the next update ??????????????,1,Postive,"good app,update,thay,Live Better Savings,Hide option,",NULL
2058,Google Play Store,Capitec Bank,celia van rooyen,5,09/10/2020 00:00:00,It is easy to use. I am a pensioner and do not the technologies used easy to understand. The Capitec App is userfriendly,0.943829774856567,Postive,"pensioner,Capitec App,technologies,",NULL
2059,Google Play Store,Capitec Bank,Max,3,05/10/2020 00:00:00,"I was using this app very nicely until I was forced to reinstall it. The problem I have now is that, when I'm trying to login with my remote pin and I press Sign in button and loading. After loading it stops there so that I will have to press the sign in button again because the pin is already there. It keeps on happening again and again with no progress.",0.0000182092189788818,Negative,"progress,problem,app,login,remote pin,loading,button,Sign,",NULL
2060,Google Play Store,Capitec Bank,Lunam Fumanisa,5,05/10/2020 00:00:00,"It works perfectly for me. In those rare instances when it is offline or I am unable to log in for whatever reason, I am notified by message beforehand. Truly satisfactory",0.217320799827576,Negative,"message,rare instances,reason,",NULL
2061,Google Play Store,Capitec Bank,Neneletu Quesherman,4,05/10/2020 00:00:00,Guys I have been experiencing difficulties to login but I guess the solution is updating the app. After updating the app everything is now fine. Just update the app you won't struggle again. #Capitecmustpaymeforthis,0.206299066543579,Negative,"Capitecmustpaymeforthis,solution,Guys,difficulties,login,app,",NULL
2062,Google Play Store,Capitec Bank,Dominik OBE,4,05/10/2020 00:00:00,"Very good app in terms of user friendliness, got used to it within minutes. But my credit history doesn't seem to pick up on the app though, might also be the reason why I can't get the credit card?",0.137497365474701,Negative,"minutes,reason,terms of user friendliness,credit card,credit history,good app,",NULL
2063,Google Play Store,Capitec Bank,Wanald Kgotlelelo,1,05/10/2020 00:00:00,"Useless app every time when I try to do online purchases or send money, it keeps on saying ERROR we are aware of the issue and aim to have it resolved.",0.00477227568626404,Negative,"issue,Useless app,online purchases,money,ERROR,time,",NULL
2064,Google Play Store,Capitec Bank,Kyle Lackay,1,03/10/2020 00:00:00,"Well thanks for ignoring the whole point of my previous review. The app shuts down when activating live better savings, any fix for this?",0.137933194637299,Negative,"thanks,app,previous review,fix,point,live better savings,",NULL
2065,Google Play Store,Capitec Bank,thobeka thobei,1,03/10/2020 00:00:00,"When I log into my app, it only shows my stop order account and live better savings account, it doesn't show my actual main saving account. And if I do cellphone banking, it does same thing, what happened on my actual savings account??",0.000247716903686523,Negative,"app,cellphone banking,thing,actual main saving account,live better savings account,stop order account,actual savings account,",NULL
2066,Google Play Store,Capitec Bank,Mmuso Tsatsa,1,05/09/2020 00:00:00,I have trouble loggin into my banking app i had to delete it and install it again and now some of my beneficiaries are missing and some info. It is also slow. I miss the old app this one has lots of problems and its fustrating.,0.000000119209289550781,Negative,"info,beneficiaries,fustrating,lots of problems,trouble loggin,old app,banking app i,",NULL
2067,Google Play Store,Capitec Bank,Precious Kekana,1,04/09/2020 00:00:00,"This app is so useless??I wouldn't advice any to use Capitec. I switched off internet banking but still someone was able to purchase online using my banking details. I went to the bank to reverse it, I didn get help. But told me to change my bank account. Y'all don't even deserve a star ??",0,Negative,"Capitec,help,star,Yall,didn,app,advice,bank account,banking details,internet banking,",NULL
2068,Google Play Store,Capitec Bank,Vumile Masiye,1,04/09/2020 00:00:00,"Bad bad not good. Face scanned 100 times, it still says try again.?? Waste of time and data",0.00000184774398803711,Negative,"times,Face,data,Waste of time,",NULL
2069,Google Play Store,Capitec Bank,Lwando Xelelo,1,03/09/2020 00:00:00,"I just downloaded right now,surely its the latest version,It keeps on showing a white blank screen,I can't live like this",0.776825428009033,Postive,"latest version,white blank screen,",NULL
2070,Google Play Store,Capitec Bank,Eden Nhlema,5,03/09/2020 00:00:00,I love this app it has never disappointed me and Low costs unlike other banks keep it up guys lots of love..,0.885493040084839,Postive,"app,guys,Low costs,banks,love,",NULL
2071,Google Play Store,Capitec Bank,WK vd Merwe,1,08/08/2020 00:00:00,"Same as everyone else. Cannot access the app on new device: Activating for 5min then just starts all over when the timer runs out. IT has been FOUR months now. I still cannot access my account and it STILL says ""Activatingg... Do not close the app."" whenver I open or reinstall it, FFS. Thanks for effectively stealing my money as I cannot access it.",0.000000685453414916992,Negative,"whenver,months,timer,money,Thanks,Activatingg,account,new device,app,",NULL
2072,Google Play Store,Capitec Bank,Nosipho Radebe,1,08/08/2020 00:00:00,Wanted to reverse a debitcheck bt it keeps on giving me an error saying unable to process and its been saying dat for da past few weeks now,0.0103857815265656,Negative,"error,debitcheck bt,dat,weeks,past,",NULL
2073,Google Play Store,Capitec Bank,Hopely X Sphiwe,5,04/06/2020 00:00:00,"Wonderful app .it's a great banking app ,now I am able to understand some sort of things, learn more about banking.what I like the most is that its able to buy airtime and electricity ,transfer et cetera, and I can able to see my balance and bank statement . I can say it is a easy app to use . KEEP UP THE GOOD WORK .",0.999819993972778,Postive,"GOOD WORK,sort of things,bank statement,balance,transfer et cetera,electricity,airtime,easy app,Wonderful app,great banking app,",NULL
2074,Google Play Store,Capitec Bank,Thulani Ngwenya,1,04/06/2020 00:00:00,I wanted to try and open the account on the app but as soon as I have to scan my Smartcard ID document... It automatically restarts. Debug the app and permit users and potential clients to be able to do everything on the app without no hassles.,0.00624951720237732,Negative,"hassles,account,Smartcard ID document,permit users,potential clients,app,",NULL
2075,Google Play Store,Capitec Bank,Kgomotso Motlhakane,1,04/06/2020 00:00:00,"The only think I dislike about capitec the app worked for a month went off ..the old app never showed me drama this one ahh shame zero,I already escalated via Facebook the whole week trouble shooting no solution yet all apps are working ...unable to connect error message where I'm using data or wifi....I'm dissapointed.",0.000000745058059692383,Negative,"capitec,Facebook,ahh shame,month,apps,solution,wifi,error message,week trouble,drama,data,old app,",NULL
2076,Google Play Store,Capitec Bank,Dawn Carrick,1,03/06/2020 00:00:00,When I try to open the account everything goes as it should until you have to scan your smart card ID when u have managed to do that it says that there is a problem that capitec is aware of. I'm very disappointed,0.000106066465377808,Negative,"account,capitec,problem,smart card ID,",NULL
2077,Google Play Store,Capitec Bank,Bradley Erasmus,1,03/06/2020 00:00:00,I already added the Easy Equities widget in my Capitec Banking app. I can't access it without data it seems. Why could I previously access it without needing data and suddenly now it's impossible?,0.000059276819229126,Negative,"Easy Equities widget,Capitec Banking,data,",NULL
2078,Google Play Store,Capitec Bank,Nthabeleng Kgwete,1,02/06/2020 00:00:00,I am seriously not happy with this app o liked the old one more i bought a new phone and i have been installing this app for more than 4 times now it keeps telling me to wait for 5 minutes and After it says retry,0.000669360160827637,Negative,"minutes,times,new phone,app o,",NULL
2079,Google Play Store,Capitec Bank,medupe motsei,1,10/05/2020 00:00:00,"Application keeps saying currently unavailable,, and we are talking about my money here which I should be able to access at any given time of the day. A month cannot go by without this issue, last time it took a week to be resolved, and yesterday it came again and I don't know how long it's going to take this time around, what makes it worse is that it's month end and I need to sort out my Financials !!!!!!!!",0.000204116106033325,Negative,"Financials,week,money,Application,issue,day,month end,given time,",NULL
2080,Google Play Store,Capitec Bank,Trevor Mabunda,1,10/05/2020 00:00:00,"Keeps on saying that i must connect to the internet or WiFi, i have restarted my phone 8 X already, and this has been happening a lot with this new app, i never had issues with the previous app, this is staff that i hate and that will motivate one to change banks, there are so many options out there, so I don't have to go through this.",0.00506755709648132,Negative,"options,banks,phone,lot,internet,WiFi,issues,previous app,new app,",NULL
2081,Google Play Store,Capitec Bank,Samantha Louise de Koker,1,10/05/2020 00:00:00,"I use to love Capitec, but atleast twice a day when i try to go in to my banking app ""currently unavailable"" ""we are solving this issue"" how many years, days, months will you be trying to solve this issue? I'm reconsidering moving to a other bank. That will take me seriously. I'm really getting tired of all these issues with Capitec. When will you be fixing your app?",0.000235944986343384,Negative,"issues,months,days,years,banking app,Capitec,",NULL
2082,Google Play Store,Capitec Bank,Monique,1,09/05/2020 00:00:00,"I haven't had a problem with the capitec app but lately I've experiencing a problem which i cannot seem to open/log in to my banking app somehow there's no Internet connection when my wifi is never turned off and connection quite strong, so what seems to be the problem and whatever it is I sure hope it can be fixed asap,coz i cannot go into the bank itself as for there's no way i have time so basically I'm stranded using the app or bank and its frustrating.Please help fixing the problem.",0.000000238418579101562,Negative,"time,wifi,Internet connection,capitec app,banking app,coz i,way i,problem,",NULL
2083,Google Play Store,Capitec Bank,andre van de Venter,1,08/05/2020 00:00:00,This app is not working anymore. It keeps saying there is a connection issue when opening the app. Previously it didn't need data to be used... Now both wifi and mobile data is giving issues according to the app. Tried clearing the cache and data and even uninstalled. This is a huge problem and it isn't even being addressed. The old app showed if there is maintenance being done but not anymore. Its a dead app now,0.0000000596046447753906,Negative,"cache,connection issue,huge problem,maintenance,issues,wifi,dead app,old app,mobile data,",NULL
2084,Google Play Store,Capitec Bank,Somé Greeff,1,08/05/2020 00:00:00,"By far the worst banking app, with the most downtime - which renders your bank account useless. Bank staff act like the customer is a complete idiot and suggests clearing the cache and rebooting your phone as a solution. As if that is not the first thing you would do before complaining and bringing it to their attention that their app is BROKEN! Will be looking into an alternative banking solution, this is not worth the few bucks you save on bank fees.",0.017953097820282,Negative,"thing,attention,bucks,phone,complete idiot,cache,downtime,customer,alternative banking solution,worst banking app,bank account useless,Bank staff,bank fees,",NULL
