rid,origin,application,name,rating,date,review,sentiment-score,sentiment,key phrases,entities
1,Google Play Store,African Bank,Anele Dlamini,1,30/04/2020 00:00:00,"Worse banking app I have ever used! Refuses to log into my account. Keeps saying my ""session has ended"". It doesn't even deserve one star!",0.0014207661151886,Negative,"star,session,account,Worse banking app,",NULL
2,Google Play Store,African Bank,Portia Mpako Aphane,5,30/04/2020 00:00:00,"This app really works for me, I can transact anytime I want, view balances, open accounts and get statement ... I love it??????????",1,Postive,"app,view balances,statement,open accounts,",NULL
3,Google Play Store,African Bank,Portia Mpako Aphane,5,30/04/2020 00:00:00,"This app really works for me, I can transact anytime I want, view balances, open accounts and get statement ... I love it??????????",1,Postive,"app,view balances,statement,open accounts,",NULL
4,Google Play Store,African Bank,Sir_Stapleton,1,30/04/2019 00:00:00,"Just downloaded the app,its not allowing me to login. Giving me a error saying they cant process my request at this moment ,please try again later.",0.24347972869873,Negative,"login,app,moment,error,request,",NULL
5,Google Play Store,African Bank,Lungile Blom,5,29/12/2018 00:00:00,it's warking faster and good to heaving 2 making things eat time nometer is reigning,0.895581126213074,Postive,"warking,time nometer,things,",NULL
6,Google Play Store,African Bank,Maru madavha,1,29/11/2018 00:00:00,most of the the time the app is not working and its very slow.,0.00861221551895142,Negative,"app,time,",NULL
7,Google Play Store,African Bank,Derick Williams,5,29/10/2021 00:00:00,THANK YOU. Problem resolved. My mistake. Typed in wrong info. App running smoothly now.,0.247346639633179,Negative,"App,mistake,Problem,wrong info,",NULL
8,Google Play Store,African Bank,Frikkie Mostert,1,29/10/2021 00:00:00,"the app is useless can not login,even the e mail addres dont work.",0.000452160835266113,Negative,"app,e mail addres dont work,login,",NULL
9,Google Play Store,African Bank,Kolomane Maduna,1,29/10/2021 00:00:00,The app does not work...it keeps crashing.,0.176030308008194,Negative,"crashing,app,",NULL
10,Google Play Store,African Bank,Pelisa Xamntwana,1,29/10/2020 00:00:00,"Two weeks back,I opened My World account they told me to download the app bt it's been a week now trying and it's still not downloaded",0.112685978412628,Negative,"weeks,World account,app bt,",NULL
11,Google Play Store,African Bank,Sivenathi Mpetsheni,1,29/10/2019 00:00:00,"I just downloaded the app for the first time and it doesn't work, when I click any of the icons nothing happens. The app is practically useless at the moment",0.00192946195602417,Negative,"icons,time,moment,app,",NULL
12,Google Play Store,African Bank,Siboniso Michael Shongwe,5,29/09/2021 00:00:00,"The app makes life easy, mine is working perfectly however the biometric login is not working, hope u will fix it soon.",0.0266499221324921,Negative,"biometric login,life easy,app,",NULL
13,Google Play Store,African Bank,Quintin Moodley,4,29/09/2021 00:00:00,"The app is really grate and the features are awesome, it is now in the competitive market for leading banks",0.153179347515106,Negative,"app,features,leading banks,competitive market,",NULL
14,Google Play Store,African Bank,Chuma Tumshe,1,29/09/2021 00:00:00,I've downloaded this app twice already and it does not work on my phone. It says something about not being able to process my request and then it goes out.,0.00263294577598572,Negative,"phone,app,request,",NULL
15,Google Play Store,African Bank,mpumi sangweni,5,29/08/2021 00:00:00,User friendly and convenient ??,0.999999642372131,Postive,"User friendly,",NULL
16,Google Play Store,African Bank,mpumi sangweni,5,29/08/2021 00:00:00,User friendly and convenient ??,0.999999642372131,Postive,"User friendly,",NULL
31,Google Play Store,African Bank,BRAINLESS PRODUCTIONS,5,28/12/2021 00:00:00,A very Useful App makes everything convenient,0.934185743331909,Postive,"Useful App,",NULL
17,Google Play Store,African Bank,Adlaide Rusere,1,29/08/2020 00:00:00,This is ridiculous guys ever since i downloaded my app its always telling me that (error we can't process your request what what) so what am i supposed to do. This is really annoying guys,0.000376760959625244,Negative,"request,error,app,annoying guys,ridiculous guys,",NULL
18,Google Play Store,African Bank,Mduduzi Mthethwa,5,29/07/2021 00:00:00,"Ever since I opened African back Savings Account which is free, no monthly fees. I have total control of my credit score, App is tops & its the first banking app that is future fit.....Try African Bank I have managed my credit score closely & free........that how banking should be.",0.999569237232208,Postive,"monthly fees,total control,Savings Account,future fit,African Bank,banking app,credit score,",NULL
19,Google Play Store,African Bank,Bruce Maphumulo,5,29/07/2020 00:00:00,"Hi. I had forgotten my login Details and one of their friendly consultant assisted me and my issue was resolved efficiently. Thank you,now I can login into my profile. Regards. BX MAPHUMULO",0.912225365638733,Postive,"profile,BX MAPHUMULO,issue,friendly consultant,login Details,",NULL
20,Google Play Store,African Bank,dudu matlhwane,4,29/07/2020 00:00:00,"It's super cool,I love this app, keep up the good work.i recommend people to use it, it's reliable,fast and convenient.",0.998977065086365,Postive,"good work,people,app,",NULL
21,Google Play Store,African Bank,willem sello maseko,1,29/07/2019 00:00:00,"Very useless, can't even log into it, am trying to reset a profile I didt even create, very frustrating ??",0.000000476837158203125,Negative,"profile,log,didt,",NULL
22,Google Play Store,African Bank,willem sello maseko,1,29/07/2019 00:00:00,"Very useless, can't even log into it, am trying to reset a profile I didt even create, very frustrating ??",0.000000476837158203125,Negative,"profile,log,didt,",NULL
23,Google Play Store,African Bank,Bongi khumza Faith,1,29/05/2021 00:00:00,"It's just useless because I have got a fixed account with you and u send me smses but when I put my mobile there it says my number is not recognisable, how??? Wanted to register so that I monitor my account on the app but??",0.000467211008071899,Negative,"app,smses,mobile,number,fixed account,",NULL
24,Google Play Store,African Bank,Bongi khumza Faith,1,29/05/2021 00:00:00,"It's just useless because I have got a fixed account with you and u send me smses but when I put my mobile there it says my number is not recognisable, how??? Wanted to register so that I monitor my account on the app but??",0.000467211008071899,Negative,"app,smses,mobile,number,fixed account,",NULL
25,Google Play Store,African Bank,Faith Divine,1,29/04/2021 00:00:00,I recently opened an account and downloaded the app but I am unable to login it keeps refusing. Disappointed.,0.0000413954257965088,Negative,"account,login,app,",NULL
26,Google Play Store,African Bank,holly khumalo,1,29/04/2020 00:00:00,i cant login and it been two months now..... i deleted app and dowloaded it again ...but still i cant login,0.127358049154282,Negative,"app,months,login,",NULL
27,Google Play Store,African Bank,Dumisani Khumalo,1,29/04/2019 00:00:00,"For the few days, the app does not allow me to login. Its frustrating and you can't call to speak to a consultant during after hours.",0.000110983848571777,Negative,"login,days,hours,consultant,app,",NULL
32,Google Play Store,African Bank,Alwyn Styger,5,28/11/2021 00:00:00,"Easy as pie , makes life so much better.",0.987570822238922,Postive,"life,pie,",NULL
34,Google Play Store,African Bank,NICHOLAS CRISP,2,28/10/2021 00:00:00,The app takes to long to log in,0.080915778875351,Negative,"app,",NULL
35,Google Play Store,African Bank,Motselisi Ralitau,1,28/10/2020 00:00:00,"Cant login ever since i downloaded it,it keeps saying try again later??",0.0000276267528533936,Negative,"login,",NULL
28,Google Play Store,African Bank,Vusi Mabena,1,28/12/2021 00:00:00,Login problems. This app does not have optional options whereby it assist you if you forgot your login credentials. Remember we have morethan 1 apps that requires login details and all are different.,0.000246584415435791,Negative,"optional options,apps,morethan,login credentials,Login problems,login details,",NULL
29,Google Play Store,African Bank,eleanor jacobs,1,28/12/2021 00:00:00,"I haven't been able to open the app because it requires various permissions to which I don't understand reason for. I have a savings account and don't want any other products at this stage nor need to upload documents. Why do need access to my camera, photos and calls at this stage?",0.00131696462631226,Negative,"documents,reason,savings account,products,camera,access,various permissions,photos,app,stage,",NULL
30,Google Play Store,African Bank,Hlobisile Khuzwayo,1,28/12/2021 00:00:00,"The app just doesn't work, I have uninstalled n reinstalled. Went to the branch they helped me bt still few days down the line it doesn't log in.....total frustration",0.00259047746658325,Negative,"app,branch,total frustration,uninstalled n,line,days,bt,",NULL
33,Google Play Store,African Bank,Kaneesha De Kock,1,28/11/2020 00:00:00,"I haven't had access to the app since I've opened an account and downloaded the app. It keeps saying that it ""can't satisfy my request"". It's been extremely difficult to manage my finances. I recommend African Bank fixes this problem as soon as possible because we are not happy.",0.000088036060333252,Negative,"request,account,access,finances,African Bank,app,problem,",NULL
36,Google Play Store,African Bank,Motselisi Ralitau,1,28/10/2020 00:00:00,"Cant login ever since i downloaded it,it keeps saying try again later??",0.0000276267528533936,Negative,"login,",NULL
37,Google Play Store,African Bank,Jackson Mahoro,5,28/10/2019 00:00:00,Most reliable. I'm now able to do all transactions in comfort of my home. I can transfer funds to other banks without any Challenges.,0.902134895324707,Postive,"home,Challenges,banks,funds,comfort,transactions,",NULL
38,Google Play Store,African Bank,Philiswa Philiswa,1,28/09/2021 00:00:00,I can't log in on my app it tells me that we cannot process your request at the moment please try again later.,0.00249320268630981,Negative,"app,moment,request,",NULL
39,Google Play Store,African Bank,charlotte thotse,2,28/09/2021 00:00:00,This app is frustrating everytime you log in it gives an error.,0.00297391414642334,Negative,"error,frustrating everytime,app,",NULL
40,Google Play Store,African Bank,mhpo maake,3,28/09/2021 00:00:00,Problem login for a long time keep on say,0.103999704122543,Negative,"long time,Problem login,",NULL
41,Google Play Store,African Bank,Galaxy S20,1,28/09/2021 00:00:00,Samsung Galaxy S20 android 10....this app is not working...after you log in the app keeps on closing immediately...for how long are you NOT going to fix this problem... I've been a client since you (african bank) started and I've never been in arrears and now for a long time your does not want to stay logged in..I really need to transfer funds,0.00003090500831604,Negative,"funds,problem,arrears,african bank,client,Samsung Galaxy S20 android,long time,app,",NULL
140,Google Play Store,African Bank,IGNATIUS MABAPA,4,26/02/2021 00:00:00,Good and very easy to access,0.944644570350647,Postive,,NULL
142,Google Play Store,African Bank,Paul Spies,1,26/01/2019 00:00:00,I cant login in. I get an error everytime i open the app,0.0430005788803101,Negative,"login,app,error everytime i,",NULL
307,Google Play Store,African Bank,Mothusi Maje,5,29/11/2021 00:00:00,The credit report feature is brilliant.,0.928061723709106,Postive,"credit report feature,",NULL
308,Google Play Store,African Bank,Caleb Shanglee,1,28/11/2021 00:00:00,I can't login at all after updating.,0.207495629787445,Negative,"login,",NULL
42,Google Play Store,African Bank,Patricia Sibanda,1,28/09/2021 00:00:00,(We cannot process your request at present please try again later) I get this error!,0.0689850747585297,Negative,"error,present,request,",NULL
43,Google Play Store,African Bank,Ronita Van Heerden,1,28/09/2021 00:00:00,"Not one good review. I usually check the reviews to assist me with deciding whether or not I have to download an app According to the below, definitely not worth my data...",0.22938871383667,Negative,"data,app,reviews,good review,",NULL
44,Google Play Store,African Bank,thamsanqa nhone,1,28/09/2021 00:00:00,I am using huwau p30 light since I downloaded the from 30/04/20 it keeps on saying we are apologize at moment we can satisfy your requests I not happy at all I have to call the bank from time to time to log into my internet banking,0.060916393995285,Negative,"moment,internet banking,huwau p30 light,requests,time,",NULL
45,Google Play Store,African Bank,Mahlatse Kgoete,1,28/09/2021 00:00:00,"I cannot even login using this app, everytime i try to login i get this message ""warning we cannot process your request at present please try again later"" i deleted the app and downloaded it again but still the same thing",0.00000351667404174805,Negative,"thing,request,message,present,app,everytime i,login i,",NULL
46,Google Play Store,African Bank,theo chetty,1,28/09/2021 00:00:00,"""We apologise but we cannot process your request at the moment"". I am uninstalling this app. Its completely useless. Have been trying to log in for over 6 months now same message. So glad im almost done with paying of my cresit card coa i really dont wana deal with african bank again.",0.0115247666835785,Negative,"glad im,message,months,moment,request,african bank,cresit card coa,dont wana deal,",NULL
47,Google Play Store,African Bank,Chris Therapist,5,28/09/2020 00:00:00,Opened new account and can not even download the app. Dissapointment from the start.,0.5,Postive,"start,Dissapointment,new account,",NULL
48,Google Play Store,African Bank,Sheri Saldulkar,1,28/09/2020 00:00:00,Using a Samsung S9+ and unable to download this app. Able to download other apps though.,0.0512329339981079,Negative,"apps,Samsung S9,",NULL
49,Google Play Store,African Bank,Nella Kiva,5,28/08/2021 00:00:00,Very nice and easy to use. Love that I get to see my bureau details in it. Love that I can buy airtime from as little as R2. I love that I can simply scroll through my contacts on my fone to buy airtime without logging off. Thank you for the convenience,0.999968409538269,Postive,"convenience,bureau details,fone,contacts,R2,airtime,Love,",NULL
50,Google Play Store,African Bank,Walter Charakupa,1,28/07/2021 00:00:00,"App doesnt work, cant do instant transfers. Funds keep on being reversed and inbox messeges keep on showing as unread even you have read it and show a delete error when i try to delete it. Very poor app development for a bank",0.000409841537475586,Negative,"Funds,inbox messeges,bank,instant transfers,poor app development,delete error,App doesnt work,",NULL
51,Google Play Store,African Bank,Julius Nkosi,1,28/07/2021 00:00:00,"The App just stopped working and it needs me to reenter my login credentials. For some reasons, I can't remember everything. There is no 'Forgot Password' section to reset password.",0.000183075666427612,Negative,"reasons,App,login credentials,section,Password,",NULL
58,Google Play Store,African Bank,Clive Muscutt Muscutt,5,28/03/2020 00:00:00,Very accurate and always up to date.A pleasure to use.,0.881126403808594,Postive,"pleasure,date,",NULL
60,Google Play Store,African Bank,Vuyisa Nombembe,1,28/03/2020 00:00:00,This app is stressful its always MIA whenever you need it its annoying,0.0025615394115448,Negative,"app,MIA,",NULL
62,Google Play Store,African Bank,Ronnie Bekker,1,28/03/2020 00:00:00,Stupid App when you try to log in it kicks you out,0.0261492133140564,Negative,"Stupid App,",NULL
52,Google Play Store,African Bank,Preacher Fakude,1,28/07/2019 00:00:00,"Dont deserve any Star, I had to put one so I post this. I'm just waiting for my pay day then immediately I go back to my old Bank. Poor stupid Bank.",0.0737687945365906,Negative,"pay day,Star,Dont,Poor stupid Bank,old Bank,",NULL
53,Google Play Store,African Bank,xolisa sakati,2,28/06/2020 00:00:00,It never worked it kept giving me an error message when I tried to loggin now I even forgot my pin n password and the App has no forgot pin and password option. Please fix that,0.000656753778457642,Negative,"error message,App,password option,pin n password,",NULL
54,Google Play Store,African Bank,Simo Blessing Nyamakazi,1,28/06/2019 00:00:00,"""We apologize but at the moment it is not possible to satisfy your request."" That's is all your new updated app does. Have y'all check or you know, you just don't care..?",0.990955471992493,Postive,"request,moment,yall check,new updated app,",NULL
55,Google Play Store,African Bank,sikhumbuzo christopher Khanyile,3,28/05/2021 00:00:00,Tried many times to login but I can't get through. There s always an era.,0.0188729763031006,Negative,"era,login,times,",NULL
56,Google Play Store,African Bank,Queen Maluleke,1,28/04/2021 00:00:00,"I can't make any transactions, it just gives an error message saying ""can't satisfy your request at the moment"" it's been well over a month now. Disappointed.",0.0000912845134735108,Negative,"month,moment,transactions,error message,request,",NULL
57,Google Play Store,African Bank,Bugsyboy3 Stig,1,28/04/2021 00:00:00,Useless app can't even register for cell phone bank always a error USELESS,0.0222723484039307,Negative,"cell phone bank,Useless app,error USELESS,",NULL
59,Google Play Store,African Bank,Christien van Zyl,1,28/03/2020 00:00:00,"I cannot do eft to my beneficiaries it tells me that the account is not valid, yet I can pay from others banks. I am using the latest version of the app.",0.0105243325233459,Negative,"banks,eft,latest version,account,beneficiaries,",NULL
61,Google Play Store,African Bank,Stephen Maduveko,3,28/03/2020 00:00:00,The app keeps failing and reversing immediate payments. The R10 charge and amount are always reversed.,0.0290777385234833,Negative,"R10 charge,immediate payments,app,",NULL
63,Google Play Store,African Bank,amukelani zakes,1,28/02/2020 00:00:00,"I have been trying to login but it keeps on saying that technical error i need to visit the branch for further assistance, and i have been there they couldn't help me",0.00213667750358582,Negative,"login,assistance,branch,technical error i,",NULL
64,Google Play Store,African Bank,Bobby ROBINSON,1,28/02/2019 00:00:00,Every time I try and load a bank listed benificary I get the message can't satisfy your request ? It is fully updated the app but still the same problem,0.0648263692855835,Negative,"request,time,problem,app,benificary,message,bank,",NULL
65,Google Play Store,African Bank,Gloria Masumu,2,28/02/2018 00:00:00,Have been using the app for months without anny error but suddenly I can't access any cell phone banking because of errors,0.000198543071746826,Negative,"anny error,months,app,errors,cell phone banking,",NULL
66,Google Play Store,African Bank,Constance Pitso,5,28/01/2018 00:00:00,Excellent quick & easy & helpful in skipping the long queue.,0.140080869197845,Negative,"long queue,",NULL
90,Google Play Store,African Bank,Clement Dankuru,2,27/10/2021 00:00:00,"I can't login, it was working fine until the recent updates.",0.0780265033245087,Negative,"login,recent updates,",NULL
92,Google Play Store,African Bank,tirelo sello,1,27/10/2021 00:00:00,Unable to login and there is no 'forgot password' option. Totally useless!,0.00765743851661682,Negative,"option,password,login,",NULL
138,Google Play Store,African Bank,Jackie Makola,5,26/03/2021 00:00:00,It is simple and understandable everything is clear,0.965255856513977,Postive,,NULL
67,Google Play Store,African Bank,ntokozo mabuza,1,27/12/2021 00:00:00,"I can't download the app, I need to do transfers & before I deleted it, it kept saying I've entered a wrong pin which is incorrect",0.000000417232513427734,Negative,"transfers,app,wrong pin,",NULL
68,Google Play Store,African Bank,Sesi Sbongile,3,27/12/2019 00:00:00,"My app can't log in with my Details I don't know why , my network is fine",0.0417593419551849,Negative,"network,Details,app,",NULL
69,Google Play Store,African Bank,Angel Khumalo,1,27/11/2021 00:00:00,"I have a problem with the app it keeps telling me ""we can't process your request at present please try again later""",0.0199449360370636,Negative,"present,request,app,problem,",NULL
70,Google Play Store,African Bank,Bantobetse Godfrey,1,27/11/2021 00:00:00,"This app isn,t working , always it says we can,t satisfy your request, what a bad experience .",0.00470906496047974,Negative,"app isn,bad experience,request,",NULL
71,Google Play Store,African Bank,Linda Khoza,3,27/11/2021 00:00:00,"Convenient App, but sometimes doesn't want to do transactions... Please guys improve that, otherwise it's a wonderful bank",0.910839676856995,Postive,"wonderful bank,guys,transactions,Convenient App,",NULL
72,Google Play Store,African Bank,Geneva Khumalo,2,27/11/2021 00:00:00,The app always requires an update but when I try to update it just keep loading ?????,0.0284703373908997,Negative,"app,loading,update,",NULL
73,Google Play Store,African Bank,Angel Nthebe,1,27/11/2021 00:00:00,Its say enter correct data and all that the old app was better,0.874281406402588,Postive,"say,old app,correct data,",NULL
74,Google Play Store,African Bank,Geneva Khumalo,2,27/11/2021 00:00:00,The app always requires an update but when I try to update it just keep loading ?????,0.0284703373908997,Negative,"app,loading,update,",NULL
75,Google Play Store,African Bank,nazeem benjamin,5,27/11/2021 00:00:00,The app has been good to me i lost my one card but with the app i cold of move my money to my other card,0.00095406174659729,Negative,"money,app i cold,card,",NULL
76,Google Play Store,African Bank,Gina Zulu,1,27/11/2020 00:00:00,Your app is terrible cant do transfer keeps saying error....,0.00141063332557678,Negative,"error,app,",NULL
77,Google Play Store,African Bank,Nomalanga Winnie,1,27/10/2021 00:00:00,Can't download the app. It's keep on downloading from this morning till now and I was using both wifi and my normal data but still not working,0.0047641396522522,Negative,"morning,normal data,wifi,",NULL
78,Google Play Store,African Bank,Macdonald Molokomme,1,27/10/2021 00:00:00,"The app wants an update, i did update and while downloading it reaches 100% and started again. 3x nows, how about my data?",0.244154810905457,Negative,"app,data,x nows,update,",NULL
79,Google Play Store,African Bank,Maru Angellah,1,27/10/2021 00:00:00,"Everything about this app is annoying, firstly I can't log in and then I can't even check my balance. Like what do you call that",0.000165551900863647,Negative,"balance,app,",NULL
80,Google Play Store,African Bank,Patricia Kheswa,1,27/10/2021 00:00:00,Before lockdown i deposited money in wyneburg capetown and the money was crushed by the machine 2days before lockdown till today they didn't refund back my money and i have been calling then they never called me back but when i go there they tell me the machine is not yet fixed this is the 7th month and u call that a bank sad,0.00520038604736328,Negative,"days,month,bank sad,wyneburg capetown,machine,lockdown i,money,",NULL
83,Google Play Store,African Bank,Cholani Somayise,5,27/10/2021 00:00:00,Excellent but it need to have a proof of payment option in it,0.91523015499115,Postive,"proof of payment option,",NULL
87,Google Play Store,African Bank,Wendy Leite,1,27/10/2021 00:00:00,My phone keep on saying try again later error message,0.105737090110779,Negative,"phone,later error message,",NULL
81,Google Play Store,African Bank,Sthelo Sigwela,1,27/10/2021 00:00:00,This app is very probamatic when it cimes to netwrk and logging -in..and the worse part about it is that it takes a huge space in the phone i mean why should it take 80MB wjole some banking apps on takes 7.1mb,0.00102806091308594,Negative,"netwrk,phone i,huge space,probamatic,logging -,banking apps,cimes,MB wjole,",NULL
82,Google Play Store,African Bank,Agnes Lebona,1,27/10/2021 00:00:00,"Am forever struggling to open my app ive updated my app, need money ans am unable to axcess it its frustrating its app its not user friendly",0.0000724196434020996,Negative,"user friendly,money ans,app ive,",NULL
84,Google Play Store,African Bank,Thabani Terrence,3,27/10/2021 00:00:00,"The app is not working to my P40 Pro it's saying apdate, when i update it shows that I've the app installed. It was working nicely on my P20 lite but to the new phone i don't know why.",0.0234488844871521,Negative,"apdate,P40 Pro,P20 lite,new phone i,app,",NULL
85,Google Play Store,African Bank,samantha-ann pillay,1,27/10/2021 00:00:00,I can't recover password or pin ...it does. It give an option to recover either or !,0.107204258441925,Negative,"option,pin,password,",NULL
86,Google Play Store,African Bank,Krypton West,2,27/10/2021 00:00:00,"I can't log in the app, it keeps saying I've entered incorrect data whilst I've entered it correctly",0.000065147876739502,Negative,"app,incorrect data,",NULL
88,Google Play Store,African Bank,Sifundo Sibiya,5,27/10/2021 00:00:00,"This app made banking much easier, I can bank anytime anywhere. I rate 5/5 although it does not run on 2G network.",0.23122850060463,Negative,"G network,banking,app,",NULL
89,Google Play Store,African Bank,mpho samuel,1,27/10/2021 00:00:00,"Once u forgot ur password and pin its impossible to logging into the app, recommend that they have an option for users whom forgot their pin or password.",0.00242319703102112,Negative,"app,option,users,ur password,pin,",NULL
