rid,origin,application,name,rating,date,review,sentiment-score,sentiment,key phrases,entities
1336,Google Play Store,Capitec Bank,Phindo Somdakakazi,2,19/09/2021 00:00:00,"I don't know what's wrong recently with my app but lately whenever I log in it always says can't sign you in please try again later. I try several times but still same problem I really don't know what's the matter and it's so frustrating cause I be needing to make a transaction but I can't because of that. Please guys if you can, fix this issue??.",0.00889047980308533,Negative,"issue,transaction,problem,times,app,frustrating cause,matter,",NULL
1337,Google Play Store,Capitec Bank,Dana Booysen,1,19/09/2021 00:00:00,The amount of effort required to get this app to work is really concerning. The standard response of contact us on twitter or Facebook make me think they don't have a help desk that takes calls to resolve Internet banking issues. Using the suggested social media platforms the time to get a response is seriously long and the thelp is not solving anything. Guess the subscriber must just live without it or bank elsewhere.,0.0178560018539429,Negative,"subscriber,thelp,Facebook,app,effort,help desk,twitter,Internet banking issues,suggested social media platforms,time,calls,standard response,",NULL
1559,Google Play Store,Capitec Bank,Ina Pretty,5,23/01/2022 00:00:00,Opening Account,0.5,Postive,"Account,",NULL
1338,Google Play Store,Capitec Bank,Karabo Jansen,1,19/09/2021 00:00:00,"I honestly thought updating my old capitec app was was going be a good idea. Oh boy was i wrong! Ever since i updated my app. My app has been misbaving, it doesn't connect and it keeps telling me to retry again later. The new updation was totally unnecessary. It messed up the whole thing. Please fix this thing.",0.00969934463500976,Negative,"misbaving,good idea,new updation,old capitec app,thing,",NULL
1339,Google Play Store,Capitec Bank,Lehlogonolo Lefty Mabulana,1,19/09/2021 00:00:00,This has to be the wprst banking app ever. I deleted the app bow when i re download it needs face recognition. Being scanning my face since morning. All this to have acces to my money.,0.00251370668411255,Negative,"morning,money,acces,face recognition,app bow,banking app,",NULL
1340,Google Play Store,Capitec Bank,Constance Thabethe,5,19/09/2021 00:00:00,It's a good app.even at bank ?? when they have a problem they send me an SMS that's why I like it,0.978145003318786,Postive,"SMS,good app,problem,bank,",NULL
1341,Google Play Store,Capitec Bank,Chris van den Berg,2,19/08/2021 00:00:00,I heard all this commotion about using the app to open a bank account online and that its absolutely amazing but it's extremely faulty for me. The face scanning step works fine but for some reason it just doesn't work when scanning my smart ID card. I've tried over and over and over but it won't work. It's really disappointing.,0.00173121690750122,Negative,"commotion,reason,smart ID card,bank account online,app,face scanning step,",NULL
1342,Google Play Store,Capitec Bank,Aisha Isaacs,1,19/08/2020 00:00:00,"I've tried installing the app on my phone so many times it keeps giving me a 5 minute timer, when it's finished it tells me to try again. I have things I need to sort on my account and really don't want to go to the branch.please fix this..",0.00443652272224426,Negative,"branch,account,things,minute timer,times,phone,app,",NULL
1343,Google Play Store,Capitec Bank,Lerato Mokoena,1,19/08/2020 00:00:00,The worst and slowest app I have on my phone it was possible I'd give it 0 stars.... Sometimes it works and sometimes it doesn't and you can't trace your money the way they make it seem.,0.0112730264663696,Negative,"stars,way,money,worst,slowest app,phone,",NULL
1344,Google Play Store,Capitec Bank,Shuan Naicker,1,19/08/2020 00:00:00,I had this app tgen unstalled it gt it back nw an its nt activating. It counts down an says try again this is happening for a long time. I can not use the app at all bcz its nt activateted an im lossing clients due to this faulty app. HELP NEEDED SOON AS POSSIBLE PLZ,0.0000095069408416748,Negative,"long time,POSSIBLE PLZ,nw,bcz,gt,HELP,im lossing clients,app tgen,",NULL
1345,Google Play Store,Capitec Bank,Kevin Stevens,4,19/08/2020 00:00:00,Very secure but not the most user friendly app due to navigation on app layout can be improved to make it more easier for the user,0.211281299591064,Negative,"navigation,app layout,user friendly app,",NULL
1346,Google Play Store,Capitec Bank,Hilla Alexander,1,19/08/2020 00:00:00,Really this app is useless Really you must wait 5 min but it doesn't open then you must retry again Really Really bad Not all of us have a change to gou to the bank some of us like me are working 7days a week No man Really I'm really not happy I will rate you 0 for this app,0.0000862777233123779,Negative,"week,days,bank,gou,change,man,app,",NULL
1490,Google Play Store,Capitec Bank,Tshepo Mahlake,5,13/08/2021 00:00:00,User friendly,0.969902276992798,Postive,"User friendly,",NULL
1491,Google Play Store,Capitec Bank,Nikithemba Nomnganga,5,13/08/2021 00:00:00,Useful simple to use,0.879252314567566,Postive,,NULL
1492,Google Play Store,Capitec Bank,Kopano Khothatso,1,13/08/2021 00:00:00,It doesnt open.its only shows capitec logo and thats it,0.226799041032791,Negative,"thats,doesnt,capitec logo,",NULL
1347,Google Play Store,Capitec Bank,nokusiza khoza,5,19/08/2020 00:00:00,"Thank you,I never expirience any difficulties when installed app to my new device was easily successfully",0.911866068840027,Postive,"expirience,new device,difficulties,app,",NULL
1348,Google Play Store,Capitec Bank,Lezaan Davids-Downes,1,19/08/2020 00:00:00,"This app doesnt help at all. I thought it would be easy to do, but every single time I get the same answer, Unable to process your sellection. We are aware of the issue and aim to have it resolved....I mean, how long now....I've been trying for months. I dont have the time to go to a branch to do this, thus me trying to get it on my phone. The app is supposed to make life easier, isnt it? I dont have any problem with my other banking app and I dont even have to go to a branch to activate it.",0,Negative,"phone,months,issue,isnt,sellection,problem,life easier,answer,single time,app doesnt help,branch,banking app,dont,",NULL
1349,Google Play Store,Capitec Bank,Mandlenkosi Mthethwa,1,19/08/2020 00:00:00,"Previous app was working well till I was forced to download new app version 2.0.93 and it's not working at all. After signing in, every move i make freezes the app, then I closed it and sign in again, same results. I am tired now and hopeless",0.00000163912773132324,Negative,"results,sign,freezes,new app version,Previous app,",NULL
1350,Google Play Store,Capitec Bank,Jas Arts,1,19/08/2020 00:00:00,This app is terrible honestly. For days now all it does is ask for my pin and account number and then it starts the 5 minute countdown over and over again.,0.0487967133522034,Negative,"days,minute countdown,app,account number,pin,",NULL
1351,Google Play Store,Capitec Bank,Juliet Molele,1,19/08/2020 00:00:00,I give it a no star since this app has changed this days they need to selfies which dont work at all i tried this 5 times and it keeps saying app keeps stopping,0.0142764449119568,Negative,"star,times,days,dont work,selfies,app,",NULL
1352,Google Play Store,Capitec Bank,Ayanda Ngcethe,1,19/07/2019 00:00:00,The rating is not about App functionality but about the instruction I get when my access to the App have been blocked and I asked for OTP from call centre. They should have advised me that I should go to the branch because OTP doesn't work. I asked one person about they told the best option is going to the branch because OTP doesn't work. My request is that please just advise bankers to go to the branch instead of wasting money on calling to get OTP.,0.000000536441802978516,Negative,"centre,request,money,bankers,access,rating,person,best option,instruction,App functionality,branch,OTP,",NULL
1353,Google Play Store,Capitec Bank,Sibusiso Nkosi,1,19/07/2019 00:00:00,"This app is nonsense l!!! It was workig fine in my previous phone i changed phones and installed it but now it keeps giving me 5mins countdown n busy saying retry after that it starts over again wanting my account number n pin,????this is annoying",0,Negative,"nonsense,app,phones,workig,previous phone i,mins countdown n busy,account number n pin,",NULL
1354,Google Play Store,Capitec Bank,Benjamin Ntuli,3,19/07/2019 00:00:00,This app is excellent for me and at anytime. iam able to download load it without going to the branch i expirence problem and they assist you 24/7 on call centre.BIG UPS,0.188120484352112,Negative,"UPS,app,expirence problem,iam able,branch,load,",NULL
1494,Google Play Store,Capitec Bank,Sphamandla Palo,5,13/08/2021 00:00:00,Perfect and so easy to excess,0.983129978179932,Postive,,NULL
1496,Google Play Store,Capitec Bank,Samantha Goliath,2,13/08/2020 00:00:00,My banking balance of Samantha goliath,0.5,Postive,"banking balance of Samantha goliath,",NULL
1497,Google Play Store,Capitec Bank,Donald Molefe,5,13/08/2020 00:00:00,Good,0.969902276992798,Postive,,NULL
1498,Google Play Store,Capitec Bank,Rabelani Mudau,5,13/08/2020 00:00:00,Good,0.969902276992798,Postive,,NULL
1355,Google Play Store,Capitec Bank,KING Speeches,1,19/06/2021 00:00:00,"Stupid app. Been Trying to do the face recognition thing for the past day now , waste of time honestly. Fix It Asap, Sucks.",0.0539821684360504,Negative,"Sucks,waste of time,face recognition thing,past day,",NULL
1356,Google Play Store,Capitec Bank,Semone Alonzo,5,19/06/2020 00:00:00,This bank is gone very expensive 7 rand for each cash send is very greedy we should pay for cash send url need to also.make us take stuff. Like airtime in advance coz we always putting money in our accounts but wen it's empty we no.longer can use the app so boring like tht 4 and emgarncey,0.06462362408638,Negative,"airtime,emgarncey,app,wen,accounts,advance coz,tht,rand,money,cash send,",NULL
1357,Google Play Store,Capitec Bank,Khanyisani Buthelezi,1,19/05/2021 00:00:00,This app is worst ever ... To trying one and the same thing when you want to active the app on phone .. Its give you 5min after that same story again,0.0026395320892334,Negative,"story,thing,phone,app,",NULL
1358,Google Play Store,Capitec Bank,Bayanda Praise,1,19/05/2021 00:00:00,I've been trying to activate my account it counts down 5 minutes then start the count down again.,0.190728068351746,Negative,"account,minutes,",NULL
1359,Google Play Store,Capitec Bank,Chadley reith,1,19/05/2021 00:00:00,Lost my phone trying to reopen my account app on my phone but seems nothing is happening taking to long retry retry..,0.00092199444770813,Negative,"account app,phone,",NULL
1360,Google Play Store,Capitec Bank,Hazel Mhlongo,1,19/05/2020 00:00:00,I can't do anything it keep saying 'Capitec keep stopping' it's been 3 days now trying to use the app. It's frustrating because I really want to use the app .,0.0000124573707580566,Negative,"app,days,Capitec,",NULL
1361,Google Play Store,Capitec Bank,Mpho Mothiba,5,19/05/2020 00:00:00,I love this Banking App all things here are easy to use and perfect.,0.994897842407226,Postive,"things,Banking App,",NULL
1362,Google Play Store,Capitec Bank,Reneiloe Joy Ntsibande,1,18/12/2021 00:00:00,"I want to purchase an item on a Google platform but my transaction keeps on being declined, I called and sent emails to the capitec customer service center but still no help or response.",0.113862961530685,Negative,"response,transaction,item,Google platform,emails,help,capitec customer service center,",NULL
1363,Google Play Store,Capitec Bank,kevin bozza,1,18/12/2021 00:00:00,I activated this app and it was fine for few days... and now its says error every time i wanna use it ... i uninstalled and installed it... now it says my pin is incorrect,0.0158751010894775,Negative,"app,pin,days,error,time i wanna,",NULL
1364,Google Play Store,Capitec Bank,Christian Birks,1,18/12/2021 00:00:00,This app doesn't work. It keeps on saying that you should do the process over and still doesn't work after you try again,0.000037848949432373,Negative,"process,app,",NULL
1365,Google Play Store,Capitec Bank,shanice pienaar,1,18/04/2020 00:00:00,My app doesn't open. I uninstalled it and still doing the same thing. The old app was much better then this. Some services I can't even use on this app. When accessing the app it keeps going blank. Time after time. This is really frustrating. Update: I've gone to the bank and tried reactivating my app as suggested on Facebook. My app still don't want to work and my Android version is within the range the app allows. Why does it stay blank?,0.00000169873237609863,Negative,"services,thing,Facebook,Update,bank,Android version,range,Time,old app,",NULL
1380,Google Play Store,Capitec Bank,Bongiwe maTshabalala Dumakude,5,17/09/2021 00:00:00,"Excellent app easy to access and helpful, quick,easy to use.",0.910191595554352,Postive,"Excellent app easy,",NULL
1389,Google Play Store,Capitec Bank,Tebogo M.,1,17/08/2020 00:00:00,"Loved how easy it was to login. I can't login anymore, the screen is blank.",0.131183564662933,Negative,"screen,login,",NULL
1366,Google Play Store,Capitec Bank,Anthony Dlamini,4,18/04/2013 00:00:00,"The app is fine,my only problem is that the app used to send capitec notifications whenever ii received money or whenever it went out. Now it stopped I dont know if its the upgraded version or something is wrong with my app",0.000516027212142944,Negative,"money,dont,problem,capitec notifications,upgraded version,app,",NULL
1367,Google Play Store,Capitec Bank,Rungwane Beauty,1,18/04/2013 00:00:00,"Your app says remote banking is unsuccessful and I should visit your branch, fix that it's really annoying",0.152525126934052,Negative,"branch,remote banking,app,",NULL
1368,Google Play Store,Capitec Bank,Lucy Munemo,1,18/03/2021 00:00:00,Am failing to access my application since yesterday it wont open what could be the problem. I can't do any transactions am so frustrated,0.00000110268592834473,Negative,"problem,application,transactions,",NULL
1369,Google Play Store,Capitec Bank,Melanie Murray,1,17/12/2020 00:00:00,"Trying to scan my face, have tried numerous times, different places and it keeps telling me not enough phone movement. Not convenient or use friendly at all.",0.0298944115638733,Negative,"phone movement,face,different places,numerous times,",NULL
1370,Google Play Store,Capitec Bank,Ishaam MacKenzie,1,17/12/2020 00:00:00,"The app is terrible, my internet connection is fine, but it refuses to open the app or log in. I tried deleting the app and downloading it again and it keeps stopping at 60%",0.0000111758708953857,Negative,"log,internet connection,app,",NULL
1371,Google Play Store,Capitec Bank,Wonder Lubisi,1,17/12/2020 00:00:00,Useless app to do on your own it doesn't work. On this pandemic you still forced to go an que at the branch. Very disappointed time waister..,0.000114172697067261,Negative,"pandemic,branch,que,Useless app,disappointed time waister,",NULL
1372,Google Play Store,Capitec Bank,Deleni Rachel Sishuba,1,17/12/2020 00:00:00,"Does not recognize my account number, because the app doesn't ask to access your location and information like other apps , my old app I downloaded at the bank long time ago , really this is pathetic and I see most of negative reviews as far as August but nothing has been done to fix the problem. I tried all the above I even went to the Mall of the South Bank and I was told they are offline, really I gave one star because there's no zero ,so disappointed",0.0000270605087280273,Negative,"problem,star,negative reviews,account number,Mall,location,information,apps,bank long time,South Bank,old app,",NULL
1373,Google Play Store,Capitec Bank,Thembilizwe Crosby Mxokozeli,3,17/11/2021 00:00:00,I like the Bank itself! But recently I cannot deposit on my trading account via EFT using an online gateway! The last step to pay the client doest pop on the app contacted support on my broker and I was told its on Capitec side. This been happening for a week! If Capitec removed this feature for us to be able to deposit...trust mw we are taking our monies elsewhere where we will be allowed to deposit with no restrictions. Tyme bank goes through but I like Capitec. Please have a look into this.,0.0307410061359406,Negative,"look,restrictions,week,feature,broker,monies,step,trust mw,online gateway,trading account,support,EFT,client doest pop,app,Tyme bank,Capitec,",NULL
1524,Google Play Store,Capitec Bank,Eskay Mbayi,1,24/01/2022 00:00:00,teenagers are disallowed to open accounts,0.108011484146118,Negative,"open accounts,teenagers,",NULL
1525,Google Play Store,Capitec Bank,Thandiwe Nzama,5,24/01/2022 00:00:00,I love it,0.969125270843506,Postive,,NULL
1526,Google Play Store,Capitec Bank,Nonceba Madunjwa,4,24/01/2022 00:00:00,"Great,easy to transfer funds",0.851335227489471,Postive,"funds,",NULL
1527,Google Play Store,Capitec Bank,Edna Daniels,5,24/01/2022 00:00:00,Didnot try it,0.820641398429871,Postive,"Didnot,",NULL
1530,Google Play Store,Capitec Bank,Lwazi Biyela,5,24/01/2022 00:00:00,Nice,0.969902276992798,Postive,,NULL
1374,Google Play Store,Capitec Bank,sonja ross,1,17/11/2021 00:00:00,Don't know if Im the only one experiencing this...I can't buy electricity on the app grrrrrrrr. This is so inconvenient,0.0000947713851928711,Negative,"Im,app grrrrrrrr,electricity,",NULL
1375,Google Play Store,Capitec Bank,Leane Ellis,1,17/11/2020 00:00:00,Totally annoying to try get the selfies is ridiculous not enough movement over and over what a waste of time!,0.0164627730846405,Negative,"waste of time,selfies,movement,",NULL
1376,Google Play Store,Capitec Bank,Khetz Khetz,1,17/11/2020 00:00:00,This app is still not working through its going back to the same place ..keeps on wanting me to face scan but remains there,0.5,Postive,"scan,place,app,",NULL
1377,Google Play Store,Capitec Bank,Xolani Samuel Khumalo,5,17/11/2019 00:00:00,"Good app yes it is, I've only used it few years and it doesn't take anything from anyone?? ??Best secured service always. I am impressed with the capitec ??",0.978217720985413,Postive,"capitec,years,Good app,Best secured service,",NULL
1378,Google Play Store,Capitec Bank,Arnold See,3,17/10/2019 00:00:00,"Good,only problem is that when you make a transaction you can't share the details that you paid, like Std bank, which gives you the option to send a Wassap message that you.paid",0.888744592666626,Postive,"transaction,problem,Wassap message,Std bank,details,option,",NULL
1379,Google Play Store,Capitec Bank,Ferico Boshoff,2,17/09/2021 00:00:00,The app is easy to use but still n put my remote pin in it don't want to access it says incorrect pin,0.00280722975730896,Negative,"app,incorrect pin,remote pin,",NULL
1381,Google Play Store,Capitec Bank,Olly Vukaphi,1,17/09/2020 00:00:00,If the app was updated the updated version is bad. I've been trying to log into my account for about 3 days now and it won't let me. After saying it is activating and making me wait it just says error and go back to account number. If it does ask me to scan my face then it will say error then go back. If I could honestly I'd give it zero stars ??,0.000469088554382324,Negative,"stars,face,days,app,account number,updated version,error,",NULL
1382,Google Play Store,Capitec Bank,Noorah Thompson,1,17/09/2020 00:00:00,Is there perhaps a problem with the app? I have been trying since yesterday to access my account. The app doesnt even open for me to put in my pin. It just gives me a blank screen.. This is an update on my review. Still the same problem. So if i cant access my account i might as well not have the account and im sure as hell not buying a new phone. 2 weeks and still no change. If this app had a minus star rating you sure would be on it,0.000255316495895386,Negative,"pin,change,review,update,weeks,blank screen,new phone,minus star,hell,im sure,problem,app doesnt,account i,",NULL
1383,Google Play Store,Capitec Bank,Mthobisi Ndaba,3,17/09/2020 00:00:00,I like the simplicity of this App but I have to say that I'm really disappointed. Somehow when you're adding a beneficiary with a long name. The name cannot be be fully written. It has a problem with long description.,0.892704129219055,Postive,"beneficiary,App,simplicity,problem,long description,",NULL
1384,Google Play Store,Capitec Bank,Phumzile Zungu,1,17/09/2019 00:00:00,"I have been using this app for some time now but recently i tried to log in,when i enter the remote banking pin it does'nt want to go through, i dont understand because i have'nt change the pin. Next thing it says access have been suspended...i'm confused",0.0280584692955017,Negative,"app,dont,im,thing,time,havent,access,doesnt,remote banking pin,",NULL
1532,Google Play Store,Capitec Bank,Sisipho Msi,5,24/01/2022 00:00:00,Best app ever!!!??,0.999998807907104,Postive,"Best app,",NULL
1533,Google Play Store,Capitec Bank,Mabongi Gcwensa,5,24/01/2022 00:00:00,Good,0.969902276992798,Postive,,NULL
1534,Google Play Store,Capitec Bank,Marius Van Heerden,5,24/01/2022 00:00:00,Best banking app yet,0.818940341472626,Postive,"Best banking app,",NULL
1385,Google Play Store,Capitec Bank,Bethuel Shilakoe,5,17/09/2019 00:00:00,"Hi there, please note we need to be able to reverse Send Cash on the app. We can't always have to go to the ATM or retailers to withdraw the Send Cash money. Other than that the app is working perfectly. Thank you",0.991823732852936,Postive,"app,ATM,retailers,Send Cash money,",NULL
1386,Google Play Store,Capitec Bank,Ryan Eysele,1,17/09/2019 00:00:00,"Everytime i try to view my balance the app crashes and it is super unresponsive as an app, please fix. Would havd selected 0 stars if it was an option.",0.00808826088905334,Negative,"option,havd,Everytime i,stars,balance,app crashes,",NULL
1387,Google Play Store,Capitec Bank,Amos Sekoboane,1,17/08/2021 00:00:00,This app is the worst i have been trying to restart my remote pin for days now and it keeps telling me that my account is not active i must try again and i keep trying again but it doesn't work and everytime i try to scan my face it keeps taking me back telling me to enter my account number multiple times,0.00000441074371337891,Negative,"face,app,days,remote pin,account number multiple times,everytime i,worst i,active i,",NULL
1388,Google Play Store,Capitec Bank,Janine Van Niekerk,5,17/08/2021 00:00:00,"Great service on this app and at our branch. Just some ATM's thats not working properly, but nothing wrong with the app.",0.909721255302429,Postive,"branch,ATMs thats,Great service,app,",NULL
1390,Google Play Store,Capitec Bank,Katlego Ashantey,1,17/08/2020 00:00:00,"The updated version deserves zero rating ,when it comes to scanning the face it always says error??",0.00023457407951355,Negative,"error,face,rating,updated version,",NULL
1391,Google Play Store,Capitec Bank,Nyameko Sepamla,1,17/08/2020 00:00:00,"Its only finishing my data now,its seems as if its not working at all,it doesn't exceed even 60%when downloading and stuck,i delete and retry again which is using my data for nothing.this app is meant to drain people their data.",0.000000208616256713867,Negative,"people,app,data,",NULL
1392,Google Play Store,Capitec Bank,Thane Jwayi,5,17/08/2020 00:00:00,Good but can be a problem sometimes and it takes a very long time to update.??And that really annoys me.,0.0000294148921966553,Negative,"long time,problem,",NULL
1393,Google Play Store,Capitec Bank,wesley veldsman,5,17/08/2019 00:00:00,"Awesome app , have to update the app at all times as its requested from the bank",0.207059562206268,Negative,"bank,times,Awesome app,",NULL
1394,Google Play Store,Capitec Bank,Orsbon Fatyela,1,17/05/2018 00:00:00,"Upon changing phones it said I needed to visit the branch to set up the App. Went to the Vangate Mall branch & it still showed the same error infront of them. After trying for a few min they said ""the system is probably down"" so I have to try it again later. Did so, same results. I don't know what to do, been uninstalling & installing it over & over...",0.000782489776611328,Negative,"results,system,changing phones,error infront,Vangate Mall branch,",NULL
1395,Google Play Store,Capitec Bank,melaney chetty,5,17/04/2021 00:00:00,I don't have any issues with the app at all. It's simple and Easy to use . Fast log in and quick transactions.,0.00886610150337219,Negative,"app,issues,quick transactions,Fast log,",NULL
1561,Google Play Store,Capitec Bank,THEMBANI NOBEBE,5,23/01/2022 00:00:00,It make me do everything easily,0.964328408241272,Postive,,NULL
1562,Google Play Store,Capitec Bank,Desiree Alexander,5,23/01/2022 00:00:00,Very happy,0.969902276992798,Postive,,NULL
1564,Google Play Store,Capitec Bank,Pieter Botes,5,23/01/2022 00:00:00,Nice,0.969902276992798,Postive,,NULL
1565,Google Play Store,Capitec Bank,Bongumusa Nene,4,23/01/2022 00:00:00,Great,0.969902276992798,Postive,,NULL
1567,Google Play Store,Capitec Bank,Gontse Modutoane,5,23/01/2022 00:00:00,Just want to invest 10c a day,0.199916183948517,Negative,"day,",NULL
1568,Google Play Store,Capitec Bank,David Matsobane,5,23/01/2022 00:00:00,Easy and fast,0.810266435146332,Postive,,NULL
1396,Google Play Store,Capitec Bank,FYN Merky Music,1,17/04/2020 00:00:00,I can't log into the app now because I've gotten a new phone so it does not activate after the 5 minute activation waiting period. I'm planning on changing banks,0.00143983960151672,Negative,"app,changing banks,new phone,period,minute activation,",NULL
1397,Google Play Store,Capitec Bank,musa ndlevu,1,17/04/2020 00:00:00,"My App doesn't allow me to Open it everytime I try to open it says Error, Please fix this error because I'm stuck and my Number is not working as well",0.00000324845314025879,Negative,"everytime,App,Number,Error,",NULL
