rid,origin,application,name,rating,date,review,sentiment-score,sentiment,key phrases,entities
771,Google Play Store,Bidvest Bank,Terrynaishejuma Terrynaishejuma,5,28/09/2021 00:00:00,Best,0.969902276992798,Postive,,NULL
772,Google Play Store,Bidvest Bank,Izaan Moolman,2,28/09/2021 00:00:00,Not so great I have to update this app EVERYTIME I make use of it. Irrespective of the update downloaded already. This is very frustrating.,0.00132271647453308,Negative,"use,app EVERYTIME,update,",NULL
773,Google Play Store,Bidvest Bank,Lario Samuels,3,28/09/2021 00:00:00,Looks good nice smooth Lario,0.966286420822144,Postive,"good nice smooth Lario,",NULL
774,Google Play Store,Bidvest Bank,Sandile Vezi,5,28/09/2021 00:00:00,Great app.,0.935216546058655,Postive,,NULL
775,Google Play Store,Bidvest Bank,Yvonne Viera,5,28/08/2021 00:00:00,Exellent,0.969902276992798,Postive,"Exellent,",NULL
776,Google Play Store,Bidvest Bank,Linette Robinson,1,28/08/2020 00:00:00,Cant log in useless,0.00315392017364502,Negative,"log,",NULL
780,Google Play Store,Bidvest Bank,Mongamele Mzangwe,4,28/06/2019 00:00:00,"Perfect Banking App, wish you could access even when out of data",0.0250552296638489,Negative,"data,Perfect Banking App,",NULL
777,Google Play Store,Bidvest Bank,Musa Daud,3,28/08/2020 00:00:00,Standard bank's app allows you to log in even without data. But not this one. Mobile banking app is same like using atm machine. You don't need data. What if i don't have data at that particular time and I want to work on my account?,0.00365591049194336,Negative,"account,particular time,atm machine,Standard banks app,Mobile banking app,data,",NULL
778,Google Play Store,Bidvest Bank,NG Mariti,1,28/07/2021 00:00:00,"Just waiting for bidvest to delete my account... was good until i got bank charges that dont make sense; e.g charged for reaching withdrawal limit, instead of the transaction just failing they charge you even before you update your limits before trying again",0.000436931848526001,Negative,"limits,transaction,account,withdrawal limit,sense,bank charges,dont,",NULL
779,Google Play Store,Bidvest Bank,Sershen Naidoo,1,28/06/2019 00:00:00,"The easy equities part of the app needs a major upgrade. 1. Live pricing updates would be a start 2. User interaction between browsing shares in different categories is tedious, need to go back out and scroll through the categories each and everytime.",0.159542709589005,Negative,"everytime,major upgrade,easy equities,start,Live pricing updates,app,User interaction,browsing shares,different categories,",NULL
781,Google Play Store,Bidvest Bank,Carmen Pasqualle,1,28/01/2020 00:00:00,"Not a good app at all. Cannot log in, correct details entered but it keeps telling me I'm wrong, then locks me out",0.00000214576721191406,Negative,"correct details,good app,",NULL
782,Google Play Store,Bidvest Bank,Alicia Bagley,1,27/12/2021 00:00:00,This app is so unresponsive it is actually ridiculous. It literall will not open. I have tried everything. Total waste of data and time,0.000027388334274292,Negative,"app,literall,time,Total waste of data,",NULL
785,Google Play Store,Bidvest Bank,Tina E,1,27/10/2021 00:00:00,1st I thought that it was my phone that had a problem. Then that it was my network connection that had a problem. To finally realise (after so many attempts) that it was this app. I don't understand what they did to it but it's bad. Fix it.,0.0177051723003387,Negative,"attempts,phone,network connection,problem,",NULL
786,Google Play Store,Bidvest Bank,Annie Andrews,5,27/10/2021 00:00:00,Really easy to use and has all my daily needs readily available. I've been with other banks... Bidvest definitely have their admin systems in check ??,0.964877367019653,Postive,"banks,check,daily needs,Bidvest,admin systems,",NULL
787,Google Play Store,Bidvest Bank,Tanah Rigney,3,27/10/2021 00:00:00,"Transaction history does not appear in the app at all, I have to go online in order to see what transaction appear on my account that are not on the statement yet.",0.00181594491004944,Negative,"order,app,statement,account,Transaction history,",NULL
788,Google Play Store,Bidvest Bank,Anthony Martin Okafor,5,27/10/2021 00:00:00,very good bank,0.97207772731781,Postive,"good bank,",NULL
789,Google Play Store,Bidvest Bank,Kwanele Kunene,1,27/10/2021 00:00:00,I can't update it,0.237188160419464,Negative,,NULL
790,Google Play Store,Bidvest Bank,Malick Ryland,5,27/10/2021 00:00:00,Excellent,0.969902276992798,Postive,,NULL
791,Google Play Store,Bidvest Bank,GREAT,5,27/10/2021 00:00:00,Very good,0.969902276992798,Postive,,NULL
830,Google Play Store,Bidvest Bank,Loraine Robberts,5,17/08/2021 00:00:00,Quick and easy,0.976802885532379,Postive,,NULL
831,Google Play Store,Bidvest Bank,Motlago Mokonyama,1,17/01/2022 00:00:00,We can't download Bivest app,0.233128309249878,Negative,"Bivest app,",NULL
832,Google Play Store,Bidvest Bank,Queen B Lady B,1,16/02/2021 00:00:00,Waste of time,0.032028079032898,Negative,"Waste of time,",NULL
854,Google Play Store,Bidvest Bank,Kgothatso Madimetja,5,17/01/2022 00:00:00,It's very good,0.950366318225861,Postive,,NULL
855,Google Play Store,Bidvest Bank,Jons Muks,5,17/01/2022 00:00:00,Super cool,0.976802885532379,Postive,,NULL
792,Google Play Store,Bidvest Bank,Michelle Martin,1,27/10/2020 00:00:00,My banking app won't work and I can't log on on my desktop. This app has left me stranded for money and brought my business to a standstill,0.00000599026679992676,Negative,"desktop,standstill,money,business,banking app,",NULL
793,Google Play Store,Bidvest Bank,Danenboy Tladi,1,27/10/2020 00:00:00,It don't work if I have no data,0.0379437804222107,Negative,"data,",NULL
794,Google Play Store,Bidvest Bank,Amon Dliwayo,1,27/09/2021 00:00:00,Trash. Trash. Trash... Trash app! You cannot login without having mobile data. This so called update doesn't even work. I need to make transactions. This app is trash. I rate the Bidvest experience 0 stars. I do not recommend anyone to bank with these guys... Let alone download their app that refuses to work. Trash.,0.0000157356262207031,Negative,"transactions,guys,update,stars,Bidvest experience,mobile data,login,work,Trash app,",NULL
795,Google Play Store,Bidvest Bank,Lloyd Ruvata,5,27/09/2019 00:00:00,Wonderful no glitches,0.976802885532379,Postive,"glitches,",NULL
796,Google Play Store,Bidvest Bank,Peter Yuille,1,27/08/2020 00:00:00,Not satisfactory taking hrs to download,0.213597059249878,Negative,"hrs,",NULL
797,Google Play Store,Bidvest Bank,Thany Obz MushNetsh,4,27/08/2020 00:00:00,Good,0.969902276992798,Postive,,NULL
798,Google Play Store,Bidvest Bank,kolie nel,3,27/08/2020 00:00:00,Okay,0.734717488288879,Postive,,NULL
799,Google Play Store,Bidvest Bank,Jabulani Moyo,4,27/08/2019 00:00:00,Just got the card today,0.818168759346008,Postive,"card,",NULL
800,Google Play Store,Bidvest Bank,Sallet Amadou,5,27/07/2021 00:00:00,king soopers and the other two were going with you to see how to get the money from my bank account number and pin number for my order to be able to get there until after get it done before the weekend,0.0226587057113647,Negative,"weekend,king soopers,money,order,bank account number,pin number,",NULL
801,Google Play Store,Bidvest Bank,Lethabo Boroko,1,27/07/2021 00:00:00,"It does not even launch. As soon as I click on the app it loads a few seconds then ""the app has stopped working "".I REALLY NEED to make transaction asap.",0.000414788722991943,Negative,"transaction,seconds,app,",NULL
802,Google Play Store,Bidvest Bank,Lehlohonolo Ntoele,1,27/05/2021 00:00:00,"Previous problems solved, enjoyable app to use. For safety reasons please do not build atms it is safer to swipe and withdraw cash in the shops without worrying about cards scamers.",0.834564805030823,Postive,"cards scamers,cash,safety reasons,enjoyable app,Previous problems,shops,atms,",NULL
803,Google Play Store,Bidvest Bank,Geraldo Du Toit,1,27/05/2021 00:00:00,"The app just stopped working, just loads and never reaches the login page",0.00230732560157776,Negative,"app,login page,",NULL
804,Google Play Store,Bidvest Bank,Daniel Olwagen,1,27/05/2019 00:00:00,App does not work anymore after September 2020 update. Please fix this,0.00343641638755798,Negative,"update,App,",NULL
805,Google Play Store,Bidvest Bank,Songezo Shongwe,1,27/05/2019 00:00:00,But @Bidvest Bank this app is not working. You keep on bringing a new version which still doesn't flippin function. What nonsense is this? Haysuka,0.000217407941818237,Negative,"Haysuka,nonsense,app,Bidvest Bank,function,new version,",NULL
806,Google Play Store,Bidvest Bank,Obed Mabelane,1,27/04/2020 00:00:00,This app is slow,0.00998422503471374,Negative,"app,",NULL
807,Google Play Store,Bidvest Bank,simon motshegare,5,27/03/2015 00:00:00,With Bidvest App you never go wrong,0.0167749524116516,Negative,"Bidvest App,",NULL
808,Google Play Store,Bidvest Bank,Tsietsi Masimong,4,27/02/2020 00:00:00,Is the bank that you can trust,0.831962645053864,Postive,"bank,",NULL
809,Google Play Store,Bidvest Bank,Rujean Ryklief,5,27/01/2021 00:00:00,I can not open the app,0.0531911551952362,Negative,"app,",NULL
812,Google Play Store,Bidvest Bank,Arsene Wenger,5,25/12/2020 00:00:00,Why my App doesn't want to come on?,0.108777076005936,Negative,"App,",NULL
810,Google Play Store,Bidvest Bank,Lunga Cata,1,26/12/2021 00:00:00,I can't login anymore don't know the rest I had since updated it. Sure there is a problem with the software. I tried to call or send emails I just received a reply that points to a technical problem they are working very hard to verify it.,0.976122379302978,Postive,"software,emails,rest,login,reply,technical problem,",NULL
811,Google Play Store,Bidvest Bank,Andile Mpalweni,1,26/01/2020 00:00:00,Your app is bad you don't take your clients serious knowing very well that money is now transacted online but we can't even open up the app. You have alot to learn from your competitors when it comes to creating an app or customer service,0.779830813407898,Postive,"competitors,alot,customer service,money,clients serious knowing,app,",NULL
813,Google Play Store,Bidvest Bank,LANGOOTA LANGOOTA,1,25/11/2021 00:00:00,"If the app is all.we have to judge bidvest bank on, then it looks like a slippery slope ahead.",0.0106256604194641,Negative,"app,slippery slope,bidvest bank,",NULL
814,Google Play Store,Bidvest Bank,Henco G6 gous,4,25/11/2021 00:00:00,It is good,0.950366318225861,Postive,,NULL
815,Google Play Store,Bidvest Bank,Ramadaan Robert Horsley,2,25/11/2021 00:00:00,"Each time I attempt to access the app, it just hangs and I've got to uninstall the app then reinstall it for me access it. Very frustrating ??",0.000000536441802978516,Negative,"time,app,",NULL
816,Google Play Store,Bidvest Bank,Milka Bazeka,3,25/10/2021 00:00:00,It has been working excellently but after a while its not opening at all,0.755762934684754,Postive,,NULL
817,Google Play Store,Bidvest Bank,T Marx,1,25/10/2021 00:00:00,"The bank is okay, but this app crashes so often I'm now uninstall ING it for good!",0.139666497707367,Negative,"bank,ING,app crashes,",NULL
818,Google Play Store,Bidvest Bank,Olivier Wenge,5,25/10/2021 00:00:00,My Bidvest Bank app is working perfectly and I'm happy with it.,0.216797888278961,Negative,"Bidvest Bank app,",NULL
819,Google Play Store,Bidvest Bank,Caroline Kaziyawo,1,25/10/2021 00:00:00,Its not opening,0.5,Postive,,NULL
820,Google Play Store,Bidvest Bank,Zade Trifunovic,2,25/08/2021 00:00:00,please what is wrong with this app ?,0.0577296614646912,Negative,"app,",NULL
821,Google Play Store,Bidvest Bank,jcfools &Co.,1,24/11/2021 00:00:00,"It's not working, can't even sign in. As soon as I get the ""Confirm Access"" pop-up and select ""Confirm"", it tells me I have no internet access when I clearly do.",0.00599440932273865,Negative,"pop-up,internet access,",NULL
822,Google Play Store,Bidvest Bank,Ayanda mavuso,1,24/10/2021 00:00:00,It does not open most of the time,0.23651060461998,Negative,"time,",NULL
823,Google Play Store,Bidvest Bank,K M,1,24/10/2021 00:00:00,Someone keeps deleting my reviews and I'm not getting assistance from app/technical team. I CANNOT NOR LOG ON TO MY APP.,0.0579617321491242,Negative,"reviews,technical team,app,assistance,",NULL
824,Google Play Store,Bidvest Bank,Krishna Govender,4,22/12/2021 00:00:00,"Generally app works well. I do get issues with easy equity part of app every now and then, especially for funds that are supposed to be withdrawable",0.0354421138763428,Negative,"funds,issues,easy equity,app,",NULL
825,Google Play Store,Bidvest Bank,Lindiwe Kelly Boucher,1,22/11/2021 00:00:00,Poor service and no help no matter how many emails I send.,0.175303816795349,Negative,"emails,Poor service,matter,help,",NULL
826,Google Play Store,Bidvest Bank,Amanda Hlatshwayo,1,22/11/2020 00:00:00,I can't open my statement,0.0561487078666687,Negative,"statement,",NULL
827,Google Play Store,Bidvest Bank,ARTHUR MPSHE BOKANG,5,21/11/2021 00:00:00,Safe and secure,0.976802885532379,Postive,,NULL
828,Google Play Store,Bidvest Bank,Ledile Francina Nkosi,2,21/10/2021 00:00:00,Bad,0.0521460473537445,Negative,,NULL
829,Google Play Store,Bidvest Bank,Eldwin Geldenhuys,5,17/12/2021 00:00:00,Good straightforward,0.976802885532379,Postive,,NULL
833,Google Play Store,Bidvest Bank,Kwanele S. Gumede,1,21/01/2022 00:00:00,"The design sucks, the app works when it wants to, notifications are usually late. It's basically a basic stupid app",0.00590768456459045,Negative,"notifications,design sucks,basic stupid app,",NULL
834,Google Play Store,Bidvest Bank,Lutho Noyila,1,19/01/2022 00:00:00,The App is not working,0.0214623212814331,Negative,"App,",NULL
835,Google Play Store,Bidvest Bank,W Isaac,5,18/01/2022 00:00:00,It's great,0.950366318225861,Postive,,NULL
836,Google Play Store,Bidvest Bank,sphiwe twala,4,18/01/2022 00:00:00,????????????????,1,Postive,,NULL
837,Google Play Store,Bidvest Bank,A Google user,4,18/01/2022 00:00:00,please update the teller machines in order to allow us to pull statements and pay your accounts like all the other banks and all your other bills ie your Dst Account the app is sometimes very slow especially month ends,0.000937938690185547,Negative,"month,banks,teller machines,statements,accounts,order,Dst Account,bills,app,",NULL
838,Google Play Store,Bidvest Bank,Annemarie Minnie,5,18/01/2022 00:00:00,good,0.969902276992798,Postive,,NULL
839,Google Play Store,Bidvest Bank,Lario Samuels,2,18/01/2022 00:00:00,Looks great cool Lario,0.966524720191956,Postive,"great cool Lario,",NULL
840,Google Play Store,Bidvest Bank,Christina Takarinda,5,18/01/2022 00:00:00,Great,0.969902276992798,Postive,,NULL
841,Google Play Store,Bidvest Bank,chichi mkha1,4,18/01/2022 00:00:00,We need an option of sending money like ewallet to any bank,0.26504710316658,Negative,"bank,option,ewallet,money,",NULL
842,Google Play Store,Bidvest Bank,Solly Monama,4,18/01/2022 00:00:00,Cash send to none bidvestbank is the only option missing.,0.164928108453751,Negative,"option,Cash,bidvestbank,",NULL
843,Google Play Store,Bidvest Bank,Clyton Ceejay,5,18/01/2022 00:00:00,good,0.969902276992798,Postive,,NULL
844,Google Play Store,Bidvest Bank,Bongi Noku,1,18/01/2022 00:00:00,This app is a problem Difficult to make transactions.Always need to be updated.,0.0276416540145874,Negative,"transactions,app,problem Difficult,",NULL
845,Google Play Store,Bidvest Bank,Kribesh Govender,1,18/01/2022 00:00:00,Does not open since I have upgraded. Please assist. From your biggest fan and previous employee ??. Lots of love#Me,0.223444432020187,Negative,"love,previous employee,biggest fan,",NULL
846,Google Play Store,Bidvest Bank,Yours Truly,1,17/01/2022 00:00:00,Easy equities has errors you can never have withdrawal of funds in emergency that sucks big time,0.0000368654727935791,Negative,"Easy equities,big time,errors,withdrawal of funds,emergency,",NULL
847,Google Play Store,Bidvest Bank,nadiah gunzo,5,17/01/2022 00:00:00,Helpful,0.969902276992798,Postive,,NULL
848,Google Play Store,Bidvest Bank,Mandlakayise Lungelo,1,17/01/2022 00:00:00,"I cannot log on to my account, I keep on getting notified that my details do not exist and when I try to register I'm told my details already exist in the system",0.00444182753562927,Negative,"system,account,details,",NULL
849,Google Play Store,Bidvest Bank,8 Ball Pool Supernova,5,17/01/2022 00:00:00,This app works 101%. Why users complain is very strange. I never had one problem with this app. Kudus to this app and Bidvest.,0.000421792268753052,Negative,"problem,users,Bidvest,Kudus,app,",NULL
850,Google Play Store,Bidvest Bank,Phakamani Ntshangase,1,17/01/2022 00:00:00,??????? The App now crashes after installing an update. Please fix this ASAP!,0.2157002389431,Negative,"ASAP,update,App,",NULL
851,Google Play Store,Bidvest Bank,Liseta Ellapen,1,17/01/2022 00:00:00,If I could rate this app half it would be to much.,0.244478195905685,Negative,"app half,",NULL
852,Google Play Store,Bidvest Bank,Eileen Jay,1,17/01/2022 00:00:00,Doesn't want to download,0.5,Postive,,NULL
853,Google Play Store,Bidvest Bank,celestin sefu mikombe,5,17/01/2022 00:00:00,I'm happy with the app,0.877049267292023,Postive,"app,",NULL
863,Google Play Store,Bidvest Bank,Mosidi Lekgau,5,17/01/2022 00:00:00,"The best bank ever,good service with low charges and lot of interests..Keep it up :) ;)",1,Postive,"best bank,lot of interests,low charges,good service,",NULL
864,Google Play Store,Bidvest Bank,Gjp Kyangolo,5,17/01/2022 00:00:00,"It's so beautiful app, so easy to use",0.820441484451294,Postive,"beautiful app,",NULL
865,Google Play Store,Bidvest Bank,samukelisiwe mthonbeni,1,17/01/2022 00:00:00,U need data n does not have many options mxm,0.0440351963043213,Negative,"options mxm,U need data n,",NULL
866,Google Play Store,Bidvest Bank,Seipati Modisane,1,17/01/2022 00:00:00,"The app is not user friendly. I've provided the information requested yet when I press ""next"", it doesn't take me to the next page. I'm told I've tried too many times, I must try later. I don't know what the problem is.",0.000633209943771362,Negative,"problem,times,page,information,user friendly,app,",NULL
867,Google Play Store,Bidvest Bank,Andries Badenhorst,5,17/01/2022 00:00:00,Great app,0.894477844238281,Postive,"Great app,",NULL
868,Google Play Store,Bidvest Bank,Moise Banza,5,15/01/2022 00:00:00,Excellent Application,0.97207772731781,Postive,"Excellent Application,",NULL
869,Google Play Store,Bidvest Bank,Meloney Watts,3,13/01/2022 00:00:00,Goof,0.0521460473537445,Negative,"Goof,",NULL
870,Google Play Store,Bidvest Bank,Fezile Mabase,4,11/01/2022 00:00:00,Great app,0.894477844238281,Postive,"Great app,",NULL
871,Google Play Store,Bidvest Bank,Alia van der westhuizen,5,10/01/2022 00:00:00,"Absolutely amazing app, couldnt have banked with a better bank",0.98268449306488,Postive,"better bank,amazing app,",NULL
872,Google Play Store,Bidvest Bank,Louise Mels,5,10/01/2022 00:00:00,Exceptional and very easy to use,0.941228628158569,Postive,,NULL
873,Google Play Store,Bidvest Bank,Godwin Abel,5,10/01/2022 00:00:00,this is banking made easy. thank you Bidvest,0.980609834194183,Postive,"Bidvest,banking,",NULL
874,Google Play Store,Bidvest Bank,Robert Greeff,5,10/01/2022 00:00:00,Fast and efficient,0.893832802772522,Postive,,NULL
875,Google Play Store,Bidvest Bank,nomagugu ngcobo,5,10/01/2022 00:00:00,Amazing,0.969902276992798,Postive,,NULL
876,Google Play Store,Bidvest Bank,Kitty Gomez,5,10/01/2022 00:00:00,Nice and easy to use app no problem even adds are not available and that is good,0.978097438812256,Postive,"app,problem,",NULL
877,Google Play Store,Bidvest Bank,Mbali Sibanyoni,1,10/01/2022 00:00:00,Can't update the app ??,0.326821088790894,Negative,"app,",NULL
878,Google Play Store,Bidvest Bank,Tshitende Mukendi,4,07/01/2022 00:00:00,Easy to use. No complications. Slight delay in transaction notifications.,0.928772509098053,Postive,"complications,transaction notifications,Slight delay,",NULL
879,Google Play Store,Bidvest Bank,mbongiseni zondi,4,07/01/2022 00:00:00,So far so good,0.964836478233337,Postive,,NULL
880,Google Play Store,Bidvest Bank,Bongani Zulu,1,07/01/2022 00:00:00,"Each time when I try to open this mobile banking app,I'm required to upgrade the app.Upon doing that,Istruggle to open or use it.",0.0076315701007843,Negative,"time,Istruggle,mobile banking app,",NULL
881,Google Play Store,Bidvest Bank,Reagan Solvannick,1,06/01/2022 00:00:00,I downloaded it and keep tell me try again it's about a month now,0.776821076869964,Postive,"month,",NULL
882,Google Play Store,Bidvest Bank,SG Shozi,5,06/01/2022 00:00:00,Easy to use,0.912911772727966,Postive,,NULL
883,Google Play Store,Bidvest Bank,Elsie Mey,5,06/01/2022 00:00:00,Easy to use,0.912911772727966,Postive,,NULL
884,Google Play Store,Bidvest Bank,Duduzile Mntambo,5,06/01/2022 00:00:00,Life is much more simpler now,0.819158434867859,Postive,"Life,",NULL
885,Google Play Store,Bidvest Bank,A Google user,5,05/01/2022 00:00:00,10 over 10,0.5,Postive,,NULL
887,Google Play Store,Bidvest Bank,Kaylin Gill,5,05/01/2022 00:00:00,great app,0.894477844238281,Postive,"great app,",NULL
886,Google Play Store,Bidvest Bank,CHROMATICSOUL SA Mohlabane,1,05/01/2022 00:00:00,"This app is a disaster.. it wont login .. Even thinking of cancelling my card , cause i cant access anything",0.0000181198120117188,Negative,"disaster,app,wont login,access,cause i,card,",NULL
888,Google Play Store,Bidvest Bank,Maclean Mukwevho,1,03/01/2022 00:00:00,"I really loved this app at first but after updating it become problematic. When you open it , says unexpected error occur am sick an tired of this app. Do not download the s***t",0.0280189514160156,Negative,"app,unexpected error,",NULL
889,Google Play Store,Bidvest Bank,Kolakola Mathebula,1,03/01/2022 00:00:00,"It sucks, takes forever to download and to open It's so unreliable because it doesn't open. Have to switch banks I guess",0.0000640153884887695,Negative,"banks,",NULL
890,Google Play Store,Bidvest Bank,Carol Madumo,2,03/01/2022 00:00:00,I don't understand this,0.0815161466598511,Negative,,NULL
891,Google Play Store,Bidvest Bank,tumeka sofani,1,03/01/2022 00:00:00,it says bidvest has stopped,0.246507883071899,Negative,,NULL
892,Google Play Store,Bidvest Bank,sherilee twigg,5,02/01/2022 00:00:00,"Easiest app to work with ever, banking Wise!",0.805888772010803,Postive,"banking Wise,Easiest app,",NULL
893,Google Play Store,Bidvest Bank,Dave Trevor-Roberts,5,02/01/2022 00:00:00,Very user friendly,0.969902276992798,Postive,"user friendly,",NULL
894,Google Play Store,Bidvest Bank,Ben Kabi Kabemba,1,02/01/2022 00:00:00,Good,0.969902276992798,Postive,,NULL
895,Google Play Store,Bidvest Bank,Adin Banzubaze,5,02/01/2022 00:00:00,100%works,0.768807888031006,Postive,,NULL
896,Google Play Store,Bidvest Bank,Rufus Ramotebele,5,02/01/2022 00:00:00,excellent,0.969902276992798,Postive,,NULL
897,Google Play Store,Bidvest Bank,Bonginkosi Thabede,5,02/01/2022 00:00:00,Lovely,0.969902276992798,Postive,,NULL
898,Google Play Store,Bidvest Bank,Hezee Moraba,5,02/01/2022 00:00:00,Good,0.969902276992798,Postive,,NULL
899,Google Play Store,Bidvest Bank,Bongs Khayanda,5,31/12/2021 00:00:00,Welll,0.969902276992798,Postive,"Welll,",NULL
900,Google Play Store,Bidvest Bank,The Joshman,5,12/12/2021 00:00:00,"Customer service excellent. Thank you for resolving the technical problem on this app. Couldn't ask for anything better. I am very pleased with this app ?? not to mention The Bank, its self. Simply love everything about Bidvest group & services : ). However is it possible that you guys can make this app as private as I was able to take a screen shot. On Capitec app you cannot take a screen shot , which secure your banking account more sufficient.",0.999080896377564,Postive,"self,technical problem,Customer service excellent,services,Bidvest group,guys,banking account,Capitec app,screen shot,",NULL
901,Google Play Store,Bidvest Bank,Ama Nota Gogo,1,12/12/2021 00:00:00,"Unable to log in. ""you habe tried too many times"". Have downloaded app for my tablet now trying to register it ??",0.00000524520874023438,Negative,"times,tablet,app,habe,",NULL
902,Google Play Store,Bidvest Bank,jannie solomons,2,11/12/2021 00:00:00,Not always accessible when you need to use it,0.192096710205078,Negative,,NULL
903,Google Play Store,Bidvest Bank,Clive Govender,1,11/12/2021 00:00:00,terrible bank,0.0663402080535889,Negative,"terrible bank,",NULL
904,Google Play Store,Bidvest Bank,Pitman M,1,11/12/2021 00:00:00,This is a terrible banking App. Constantly struggle to log in.,0.0365875959396362,Negative,"terrible banking,",NULL
925,Google Play Store,Bidvest Bank,Donovan Landsberg,5,30/11/2021 00:00:00,Great App,0.97207772731781,Postive,"Great App,",NULL
926,Google Play Store,Bidvest Bank,airo mussa,5,30/11/2021 00:00:00,Very good,0.969902276992798,Postive,,NULL
957,Google Play Store,Bidvest Bank,Kobus Fisher,1,03/11/2021 00:00:00,App doesnt open,0.0372069180011749,Negative,"App doesnt open,",NULL
958,Google Play Store,Bidvest Bank,Manna Mguni,5,02/11/2021 00:00:00,The app is excellent,0.759863138198852,Postive,"app,",NULL
905,Google Play Store,Bidvest Bank,Dawid Meiring,1,10/12/2021 00:00:00,"Does not verify device, says no connection, tried wifi and mobile data, deleted and reinstalled twice...no use",0.5,Postive,"use,device,wifi,mobile data,connection,",NULL
906,Google Play Store,Bidvest Bank,Mancoba Thabethe,1,10/12/2021 00:00:00,Not safe. Not Reliable. Always being hacked??????,0.000234127044677734,Negative,,NULL
907,Google Play Store,Bidvest Bank,Malakoane Peter,5,10/12/2021 00:00:00,A bit tricky but OK,0.5,Postive,,NULL
908,Google Play Store,Bidvest Bank,Rodney Chimbetete,5,09/12/2021 00:00:00,Love it to the max and very useful easy to use and the best app in SA might not be now but the grow and flexiblity the apps has is massive,0.220617115497589,Negative,"SA,max,grow,apps,flexiblity,best app,",NULL
